,Unnamed: 0,Company,Valuation ($B),Date Joined,Country,City,Industry,Select Investors
207,222,GOAT,$3.7,9/23/2020,United States,Culver City,E-commerce & direct-to-consumer,"Upfront Ventures, Webb Investment Network, D1 Capital Partners"
208,223,Noom,$3.7,5/24/2021,United States,New York,Health,"Qualcomm Ventures, Samsung Ventures, Silver Lake"
209,224,Redwood Materials,$3.7,7/28/2021,United States,Carson City,Other,"Breakthrough Energy Ventures, Capricorn Investment Group, Valor Equity Partners"
210,225,Papaya Global,$3.7,3/4/2021,United States,New York,Internet software & services,"Bessemer Venture Partners, Insight Partners, New Era Ventures"
211,226,Abogen,$3.7,11/29/2021,China,Suzhou,Health,"Hillhouse Capital Management, SoftBank Group, Qiming Venture Partners"
212,227,Harness,$3.7,1/14/2021,United States,San Francisco,Artificial intelligence,"Menlo Ventures, Alkeon Capital Management, Citi Ventures"
213,228,Autograph,$3.66,1/20/2022,United States,Santa Monica,Internet software & services,01 Advisors. Kleiner Perkins Caufield & Byers. Andreessen Horowitz
214,229,Relativity,$3.6,3/18/2021,United States,Chicago,Internet software & services,"Silver Lake, ICONIQ Capital"
215,230,Whoop,$3.6,10/28/2020,United States,Boston,E-commerce & direct-to-consumer,"NextView Ventures, Promus Ventures, Two Sigma Ventures"
216,231,Applied Intuition,$3.6,10/22/2020,United States,Sunnyvale,Data management & analytics,"Andreessen Horowitz, Lux Capital, General Catalyst"
217,232,Course Hero,$3.6,2/12/2020,United States,Redwood City,Edtech,"NewView Capital, Maveron, Ridge Ventures"
218,233,SpotOn,$3.6,5/26/2021,United States,San Francisco,Fintech,"Dragoneer Investment Group, DST Global, Franklin Templeton"
219,234,Otto Bock HealthCare,$3.52,6/24/2017,Germany,Duderstadt,Health,EQT Partners
220,235,Indigo Ag,$3.5,9/26/2017,United States,Boston,Artificial intelligence,"Activant Capital Group, Alaska Permanent Fund, Baillie Gifford & Co."
221,236,HyalRoute,$3.5,5/26/2020,Singapore,,Mobile & telecommunications,Kuang-Chi
222,237,Rec Room,$3.5,3/23/2021,United States,Seattle,Internet software & services,"First Round Capital, Sequoia Capital, Index Ventures"
223,238,Commure,$3.5,9/16/2021,United States,San Francisco,Internet software & services,"General Catalyst, HCA Healthcare"
224,239,Mirakl,$3.5,9/22/2020,France,Paris,E-commerce & direct-to-consumer,"Elaia Partners, 83North, Felix Capital"
225,240,Coalition,$3.5,3/17/2021,United States,San Francisco,Cybersecurity,"Two Sigma Ventures, Flint Capital, Commerce Ventures"
226,241,Tekion,$3.5,10/21/2020,United States,San Ramon,Internet software & services,"Airbus Ventures, Index Ventures, Advent International"
227,242,Celsius Network,$3.5,10/12/2021,United States,Hoboken,Fintech,"WestCap Group, Caisse de depot et placement du Quebec"
228,243,GoStudent,$3.5,6/22/2021,Austria,Vienna,Edtech,"DN Capital, Left Lane Capital, Coatue Management"
229,244,Highspot,$3.5,2/22/2021,United States,Seattle,Internet software & services,"Madrona Venture Group, Shasta Ventures, Salesforce Ventures"
230,245,Handshake,$3.5,5/12/2021,United States,San Francisco,Internet software & services,"Kleiner Perkins Caufield & Byers, Lightspeed Venture Partners, True Ventures"
231,246,ChargeBee Technologies,$3.5,4/20/2021,United States,San Francisco,Fintech,"Insight Partners, Tiger Global Management, Accel"
232,247,Flock Safety,$3.5,7/13/2021,United States,Atlanta,Hardware,"Matrix Partners, Initialized Capital, Tiger Global Management"
233,248,Helion Energy,$3.50,11/5/2021,United States,Redmond,Other,"Mithril Capital Management, Y Combinator, Capricorn Investment Group"
234,250,MoonPay,$3.4,11/22/2021,United States,Miami,Fintech,"New Enterprise Associates, Coatue Management, Tiger Global Management"
235,252,Youxia Motors,$3.35,4/2/2018,China,Shanghai,Auto & transportation,"China Environmental Protection Industry, China Fortune Ocean"
236,253,OwnBackup,$3.35,1/28/2021,United States,Englewood Cliffs,Data management & analytics,"Insight Partners, Salesforce Ventures, Vertex Ventures"
237,254,Starburst,$3.35,1/6/2021,United States,Boston,Data management & analytics,"Index Ventures, Coatue Management, Andreessen Horowitz"
238,255,Starling Bank,$3.34,3/8/2021,United Kingdom,London,Fintech,"JTC Group, Qatar Investment Authority, Fidelity Investment"
239,256,ECARX,$3.31,10/26/2020,China,Wuhan,Auto & transportation,"Geely, SIG Asia Investments, China State Capital Venture Capital Fund"
240,257,Sila Nanotechnologies,$3.3,4/16/2019,United States,Alameda,Other,"Bessemer Venture Partners, Sutter Hill Ventures, Matrix Partners"
241,258,Scopely,$3.3,10/29/2019,United States,Culver City,Mobile & telecommunications,"Greycroft, Sands Capital, Revolution Growth"
242,259,Komodo Health,$3.3,5/22/2020,United States,San Francisco,Health,"Andreessen Horowitz, IA Ventures, Felicis Ventures"
243,260,Kurly,$3.3,7/9/2021,South Korea,Seoul,"Supply chain, logistics, & delivery","Sequoia Capital China, DST Global, DST Global"
244,262,BlockDaemon,$3.25,9/21/2021,United States,Los Angeles,Fintech,"BOLDstart Ventures, Lerer Hippeau, Kenetic Capital"
245,263,Dadi Cinema,$3.24,5/11/2016,China,Shenzhen,Other,Alibaba Pictures Group
246,264,Aiven,$3.21,10/18/2021,Finland,Helsinki,Internet software & services,"Institutional Venture Partners, Atomico, Earlybird Venture Capital"
247,265,Thumbtack,$3.2,9/29/2015,United States,San Francisco,E-commerce & direct-to-consumer,"Tiger Global, Sequoia Capital, Google Capital"
248,266,Cedar,$3.2,3/9/2021,United States,New York,Fintech,"Thrive Capital, Founders Fund, Cocnord Health Partners"
249,268,Blockstream,$3.2,8/24/2021,Canada,Vancouver,Fintech,"AME Cloud Ventures, Future Perfect Ventures, Blockchain Capital"
250,269,Innovaccer,$3.2,2/19/2021,United States,San Francisco,Health,"M12, WestBridge Capital, Lightspeed Venture Partners"
251,270,Ironclad,$3.2,1/18/2022,United States,Sacramento,Internet software & services,"Accel, Sequoia Capital, Y Combinator"
252,271,Skims,$3.2,4/9/2021,United States,Los Angeles,E-commerce & direct-to-consumer,"Thrive Capital, Alliance Consumer Growth, Imaginary Ventures"
253,272,Eikon Therapeutics,$3.2,1/6/2022,United States,Hayward,Health,"The Column Group, Foresite Capital, Foresite Capital"
254,273,PsiQuantum,$3.15,7/27/2021,United States,Palo Alto,Hardware,"Playground Global, M12, BlackRock"
255,275,HighRadius,$3.1,1/7/2020,United States,Houston,Fintech,"Susquehanna Growth Equity, Citi Ventures, ICONIQ Capital"
256,276,Nuvemshop,$3.1,8/17/2021,Brazil,Sao Paulo,E-commerce & direct-to-consumer,"Kaszek Ventures, Qualcomm Ventures, Accel"
257,277,Yixia,$3,11/24/2015,China,Beijing,Mobile & telecommunications,"Sequoia Capital China, Sina Weibo, Kleiner Perkins Caufield & Byers, Redpoint Ventures"
258,278,Traveloka,$3,1/1/2017,Indonesia,Jakarta,Travel,"Global Founders Capital, East Ventures, Expedia Inc."
259,279,SouChe Holdings,$3,11/1/2017,China,Hangzhou,E-commerce & direct-to-consumer,"Morningside Ventures, Warburg Pincus, CreditEase Fintech Investment Fund"
260,280,BGL Group,$3,11/24/2017,United Kingdom,Peterborough,Fintech,CPP Investment Board
261,281,Circle,$3,5/15/2018,United States,Boston,Fintech,"General Catalyst, Digital Currency Group, Accel"
262,282,Zuoyebang,$3,7/18/2018,China,Beijing,Edtech,"Sequoia Capital China, Xiang He Capital, GGV Capital"
263,283,FlixMobility,$3,7/18/2019,Germany,Munich,Auto & transportation,"Holtzbrinck Ventures, Unternehmertum Venture Capital, General Atlantic"
264,284,Wildlife Studios,$3,12/5/2019,Brazil,Sao Paulo,Other,"Benchmark, Bessemer Venture Partners"
265,285,ApplyBoard,$3.2,5/5/2020,Canada,Kitchener,Edtech,"Artiman Ventures, Plug and Play Ventures, Anthos Capital"
266,286,Forter,$3,11/19/2020,United States,New York,Cybersecurity,"Sequoia Capital Israel, Scale Venture Partners, Commerce Ventures"
267,287,Calendly,$3,1/26/2021,United States,Atlanta,Internet software & services,"ICONIQ Capital, OpenView Venture Partners"
268,288,BlockFi,$3,3/11/2021,United States,Jersey City,Fintech,"ConsenSys Ventures, Valar Ventures, PUC"
269,289,ActiveCampaign,$3,4/21/2021,United States,Chicago,Internet software & services,"Silversmith Capital Partners, Susquehanna Growth Equity, Tiger Global Management"
270,290,CMR Surgical,$3,9/17/2019,United Kingdom,Cambridge,Health,"Cambridge Innovation Capital, LGT Capital Partners, Escala Capital"
271,291,Lucid Software,$3,6/29/2021,United States,South Jordan,Internet software & services,"Spectrum Equity, ICONIQ Capital, Grayhawk Capital"
272,292,Age of Learning,$3,5/3/2016,United States,Glendale,Edtech,Iconiq Capital
273,293,Carbon Health,$3,7/21/2021,United States,San Francisco,Health,"Brookfield Asset Management, Blackstone, Data Collective"
274,294,Contentful,$3,7/28/2021,Germany,Berlin,Internet software & services,"Balderton Capital, General Catalyst, Tiger Global Management"
275,295,LaunchDarkly,$3,8/10/2021,United States,Oakland,Internet software & services,"Uncork Capital, Threshold Ventures, Bloomberg Beta"
276,296,Seismic,$3,12/18/2018,United States,San Diego,Internet software & services,"Jackson Square Ventures, General Atlantic, Lightspeed Venture Partners"
277,297,Grafana Labs,$3,3/25/2021,United States,New York,Internet software & services,"Lightspeed Venture Partners, Lead Edge Capital, Coatue Management"
278,298,Gorillas,$3.1,3/25/2021,Germany,Berlin,E-commerce & direct-to-consumer,"Coatue Management, Atlantic Food Labs, DST Global"
279,299,Sky Mavis,$3,10/4/2021,Vietnam,Ho Chi Minh City,Internet software & services,"Fabric Ventures, 500 Global, Standard Crypto"
280,300,Outschool,$3,4/14/2021,United States,San Francisco,Edtech,"Uniion Square Ventures, Tiger Global Management, Lightspeed Venture Capital"
281,301,TradingView,$3,10/14/2021,United States,Westerville,Fintech,"Tiger Global Management, Insight Partners, Jump Capital"
282,303,Podium,$3,4/7/2020,United States,Lehi,Internet software & services,"Accel, Summit Partners, Google Ventures"
283,304,Via,$3.3,3/30/2020,United States,New York,Auto & transportation,"83North, RiverPark Ventures, Pitango Venture Capital"
284,305,Anchorage Digital,$3,12/15/2021,United States,San Francisco,Fintech,"Andreessen Horowitz, Blockchain Capital, Lux Capital"
285,306,Inxeption,$3,1/13/2022,United States,San Francisco,Fintech,"Coatue Management, BMO Capital, Schonfeld Strategic Advisors"
286,307,Lattice,$3,3/23/2021,United States,San Francisco,Internet software & services,"Khosla Ventures, Thrive Capital, Y Combinator"
287,308,Flutterwave,$3,3/9/2021,United States,San Francisco,Fintech,"Green Visor Capital, CRE Venture Capital, Greycroft"
288,309,Amber Group,$3,6/21/2021,Hong Kong,,Fintech,"Tiger Global Management, Tiger Brokers, DCM Ventures"
289,310,wefox,$3,3/5/2019,Germany,Berlin,Fintech,"Salesforce Ventures, Seedcamp, OMERS Ventures"
290,311,Cross River Bank,$3,2/11/2022,United States,Fort Lee,Fintech,"Battery Ventures, Andreessen Horowitz, Ribbit Capital"
291,312,Remote,$3,7/13/2021,United States,San Francisco,Fintech,"Index Ventures, Sequoia Capital, General Catalyst"
292,313,Sentry,$3,2/18/2021,United States,San Francisco,Other,"New Enterprise Associates, Accel, Bond"
293,314,Kraken,$2.92,6/25/2019,United States,San Francisco,Fintech,"Bnk To The Future, Trammell Ventures, SBI Investment"
294,315,OpenAI,$2.92,7/22/2019,United States,San Francisco,Artificial intelligence,Khosla Ventures
295,316,Workrise,$2.9,9/30/2019,United States,Austin,Internet software & services,"Founders Fund, Quantum Energy Partners, Bedrock Capital"
296,317,Loft,$2.9,1/3/2020,Brazil,Sao Paulo,E-commerce & direct-to-consumer,"Monashees+, Andreessen Horowitz, QED Investors"
297,318,DriveWealth,$2.85,8/20/2021,United States,Chatham,Fintech,"Point72 Ventures, Route 66 Ventures, Accel"
298,319,Flink,$2.85,12/1/2021,Germany,Berlin,E-commerce & direct-to-consumer,"Mubadala Capital, Bond, Prosus Ventures"
299,320,Alan,$2.85,4/19/2021,France,Paris,Fintech,"Index Ventures, Temasek, Portag3 Ventures"
300,321,Meicai,$2.8,6/22/2016,China,Beijing,Mobile & telecommunications,"Tiger Global Management, Blue Lake Capital, ZhenFund"
301,322,ContentSquare,$2.8,5/25/2021,France,Paris,Internet software & services,"Highland Europe, Eurazeo, Canaan Partners"
302,323,Zipline,$2.8,5/20/2019,United States,South San Francisco,"Supply chain, logistics, & delivery","Sequoia Capital, Baillie Gifford & Co., Google Ventures"
303,324,Graphcore,$2.77,12/18/2018,United Kingdom,Bristol,Artificial intelligence,"Dell Technologies Capital, Pitango Venture Capital, Amadeus Capital Partners"
304,325,Illumio,$2.75,4/14/2015,United States,Sunnyvale,Cybersecurity,"Data Collective, Formation 8, General Catalyst Partners"
305,326,MasterClass,$2.75,5/13/2021,United States,San Francisco,Edtech,"Institutional Venture Partners, New Enterprise Associates, Javelin Venture Partners"
306,327,Dream Games,$2.75,6/30/2021,Turkey,Istanbul,Mobile & telecommunications,"Makers Fund, Index Ventures, Inova Ventures Participacees"
307,328,Transmit Security,$2.74,6/22/2021,Israel,Tel Aviv,Cybersecurity,"General Atlantic, Insight Partners, Vintage Investment Partners"
308,329,Hozon Auto,$3.95,2/22/2022,China,Shanghai,Auto & transportation,"HD Capital, Qihoo 360 Technology, China Fortune Land Development"
309,330,Tradeshift,$2.7,5/30/2018,United States,San Francisco,Fintech,"Notion Capital, Scentan Ventures, Kite Ventures"
310,331,Nextiva,$2.7,9/14/2021,United States,Scottsdale,Internet software & services,Goldman Sachs Asset Management
311,332,o9 Solutions,$2.7,4/28/2020,United States,Dallas,Artificial intelligence,KKR
312,333,Thought Machine,$2.7,11/29/2021,United Kingdom,London,Fintech,"British Patient Capital, SEB Venture Capital, IQ Capital"
313,334,BackBase,$2.66,6/9/2021,Netherlands,Amsterdam,Fintech,Motive Partners
314,335,ManoMano,$2.6,7/5/2021,France,Paris,E-commerce & direct-to-consumer,"General Atlantic, Piton Capital, Partech Partners"
315,336,Sourcegraph,$2.62,7/13/2021,United States,San Francisco,Internet software & services,"Redpoint Ventures, Goldcrest Capital, Insight Partners"
316,337,Pendo,$2.6,10/17/2019,United States,Raleigh,Internet software & services,"Contour Venture Partners, Battery Ventures, Core Capital Partners"
317,338,Plume,$2.6,2/23/2021,United States,Palo Alto,Internet software & services,"Insight Partners, Jackson Square Ventures, Liberty Gloval Ventures"
318,339,Moglix,$2.6,5/17/2021,Singapore,,E-commerce & direct-to-consumer,"Jungle Ventures, Accel, Venture Highway"
319,340,Axonius,$2.6,3/1/2021,United States,New York,Cybersecurity,"Vertex Ventures Israel, Bessemer Venture Partners, Emerge"
320,341,Xinchao Media,$2,4/9/2018,China,Chengdu,Internet software & services,"JD.com, Baidu, Vision Plus Capital"
321,342,JumpCloud,$2.62,9/13/2021,United States,Louisville,Data management & analytics,"Foundry Group, General Atlantic, BlackRock"
322,343,Unico,$2.6,8/3/2021,Brazil,Sao Paulo,Artificial intelligence,"Big Bets, General Atlantic, SOFTBANK Latin America Ventures"
323,344,Oura,$2.55,4/5/2022,Finland,Oulu,Health,"Forerunner Ventures, Lifeline Ventures, MSD Capital"
324,345,Eat Just,$2.59,11/30/2017,United States,San Francisco,Consumer & retail,"Khosla Ventures, Horizons Ventures, Founders Fund"
325,346,Cribl,$2.5,8/25/2021,United States,San Francisco,Data management & analytics,"Institutional Venture Partners, CRV, Sequoia Capital"
326,347,Vista Global,$2.5,8/23/2017,United Arab Emirates,Dubai,Other,Rhone Capital
327,348,BYTON,$2.5,4/20/2018,China,Nanjing,Auto & transportation,"FAW Group, Tencent Holdings, Tus Holdings"
328,349,Acronis,$2.5,9/18/2019,Switzerland,Schaffhausen,Cybersecurity,"Goldman Sachs, VebVentures, Insight Partners"
329,350,Side,$2.5,3/22/2021,United States,San Francisco,Internet software & services,"Coatue Managemeny, Trinity Ventures, Matrix Partners"
330,353,Varo Bank,$2.5,9/9/2021,United States,San Francisco,Fintech,"Warburg Pincus, The Rise Fund, HarbourVest Partners"
331,354,Cato Networks,$2.5,11/17/2020,Israel,Tel Aviv,Cybersecurity,"Aspect Ventures, SingTel Innov8, Greylock Partners"
332,355,Aura,$2.5,6/9/2021,United States,Burlington,Cybersecurity,"Warburg Pincus, General Catalyst"
333,356,Vercel,$2.5,6/23/2021,United States,San Francisco,Internet software & services,"CRV, Accel, Google Ventures"
334,357,Sysdig,$2.5,4/28/2021,United States,San Francisco,Cybersecurity,"Accel, Bain Capital Ventures, Insight Partners"
335,359,Uniphore,$2.5,2/16/2022,United States,Palo Alto,Artificial Intelligence,"Chiratae Ventures, March Capital Partners, National Grid Partners"
336,360,Somatus,$2.5,2/23/2022,United States,McLean,Health,"The Blue Venture Fund, Flare Capital Partners, Longitude Capital"
337,361,Immutable,$2.5,3/7/2022,Australia,Sydney,Fintech,"Fabric Ventures, AirTree Ventures, Temasek"
338,362,A24 Films,$2.5,3/9/2022,United States,New York,Other,"Stripes Group, Neuberger Berman"
339,363,SiFive,$2.5,3/16/2022,United States,San Mateo,Hardware,"Sutter Hill Ventures, Osage University Partners, Spark Capital"
340,365,Fetch Rewards,$2.5,3/31/2021,United States,Madison,E-commerce & direct-to-consumer,"Greycroft, Loeb.NYC, DST Global"
341,366,Coda Payments,$2.5,4/15/2022,Singapore,,Fintech,"GIC. Apis Partners, Insight Partners"
342,367,Uala,$2.45,8/13/2021,Argentina,Buenos Aires,Fintech,"Soros Fund Management, Ribbit Capital, Monashees+"
343,369,Cybereason,$2.44,8/6/2019,United States,Boston,Cybersecurity,"SoftBank Group, CRV, Spark Capital"
344,370,Cgtz,$2.41,2/21/2017,China,Hangzhou,Fintech,"Shunwei Capital Partners, China Media Group, Guangzhou Huiyin Aofeng Equity Investment Fund"
345,371,Star Charge,$2.41,5/19/2021,China,Changzhou,Auto & transportation,"Shunwei Capital Partners, China Media Group, Guangzhou Huiyin Aofeng Equity Investment Fund"
346,372,EquipmentShare,$2.41,5/1/2020,United States,Columbia,Fintech,"Romulus Capital, Insight Partners, RedBird Capital Partners"
347,373,Carbon,$2.4,8/20/2015,United States,Redwood City,Hardware,"Google Ventures, Sequoia Capital, Wakefield Group"
348,375,Paxos,$2.4,4/29/2021,United States,New York,Fintech,"Liberty City Ventures, RRE Ventures, Mithril Capital Management"
349,376,Exabeam,$2.4,6/1/2021,United States,Foster City,Cybersecurity,"Norwest Venture Partners, Aspect Ventures, Lightspeed Venture Partners"
350,377,BitSight Technologies,$2.4,9/13/2021,United States,Boston,Cybersecurity,"Menlo Ventures, GGV Capital, Flybridge Capital Partners"
351,378,Trumid,$2.4,7/15/2020,United States,New York,Fintech,"T. Rowe Price, Dragoneer Investment Group, BlackRock"
352,379,ABL Space Systems,$2.4,3/25/2021,United States,El Segundo,Other,"T. Rowe Price, Lockheed Martin Ventures, Fidelity Investment"
353,380,HoneyBook,$2.4,5/4/2021,United States,San Francisco,Internet software & services,"Norwest Venture Partners, Hillsven Capital, Aleph"
354,381,Beta Technologies,$2.4,4/19/2022,United States,South Burlington,Other,"The Rise Fund, Fidelity Investments. RedBird Capital Partners"
355,382,Project44,$2.62,6/1/2021,United States,Chicago,"Supply chain, logistics, & delivery","Emergence Capital Partners, 8VC, Chicago Ventures"
356,383,Freenome,$2.62,8/26/2020,United States,South San Francisco,Health,"Andreessen Horowitz, Data Collective, Roche Venture Fund"
357,384,Bought By Many,$2.35,6/1/2021,United Kingdom,London,Fintech,"Octopus Ventures, Munich Re Ventures, CommerzVentures"
358,385,Jobandtalent,$2.35,12/1/2021,Spain,Madrid,Internet software & services,"Kibo Ventures, SoftBank Group, Atomico"
359,386,WEMAKEPRICE,$2.34,9/9/2015,South Korea,Seoul,E-commerce & direct-to-consumer,"IMM Investment, NXC"
360,387,Biren Technology,$2.32,8/18/2020,China,Shanghai,Hardware,"V FUND, IDG Capital, Green Pine Capital Partners"
361,388,Voodoo,$2.31,8/17/2020,France,Paris,Other,"Tencent Holdings, Goldman Sachs"
362,389,Uptake,$2.3,10/27/2015,United States,Chicago,Artificial intelligence,"Revolution, New Enterprise Associates, Caterpillar"
363,390,Motive,$2.85,4/23/2019,United States,San Francisco,"Supply chain, logistics, & delivery","Google Ventures, Index Ventures, Scale Venture Partners"
364,391,Skydance Media,$2.3,2/11/2020,United States,Santa Monica,Other,"RedBird Capital Partners, CJ ENM, Tencent Holdings"
365,392,Greenlight,$2.3,9/24/2020,United States,Atlanta,Fintech,"Relay Ventures, TTV Capital, Canapi Ventures"
366,393,Bowery Farming,$2.3,5/25/2021,United States,New York,Other,"Temasek, Google Ventures, General Catalyst"
367,394,Odoo,$2.3,7/29/2021,Belgium,Louvain-la-Neuve,Internet software & services,"Summit Partners, Noshaq, Sofinnova Partners"
368,395,MoMo,$2.27,12/10/2021,Vietnam,Ho Chi Minh City,Fintech,"Goodwater Capital, Warburg Pincus, GS Growth"
369,396,Zume,$2.25,11/1/2018,United States,Mountain View,Consumer & retail,"Softbank Group, AME Cloud Ventures, SignalFire"
370,397,Algolia,$2.25,7/28/2021,United States,San Francisco,Internet software & services,"Accel, Alven Capital, Storm Ventures"
371,398,Pattern,$2.25,10/6/2021,United States,Lehi,Internet software & services,"Knox Lane, Ainge Advisory, Carlson Private Capital Partners"
372,399,Newfront Insurance,$2.2,4/12/2022,United States,San Francisco,Fintech,"Founders Fund, Meritech Capital Partners, GS Growth"
373,400,NuCom Group,$2.2,2/22/2018,Germany,Unterfoehring,Other,General Atlantic
374,401,MUSINSA,$2.2,11/11/2019,South Korea,Seoul,E-commerce & direct-to-consumer,Sequoia Capital
375,402,Current,$2.2,4/27/2021,United States,New York,Fintech,"Expa, QED Investors, Foundation Capital"
376,403,Bitso,$2.2,5/5/2021,Mexico,Mexico City,Fintech,"Pantera Capital, QED Investors, Coinbase Ventures"
377,404,Gympass,$2.2,6/12/2019,United States,New York,Internet software & services,"General Atlantic, SoftBank Group, Atomico"
378,405,Dialpad,$2.2,10/6/2020,United States,San Francisco,Internet software & services,"Andreessen Horowitz, Google Ventures, Section 32"
379,406,G7 Networks,$2.2,2/15/2022,China,Beijing,"Supply chain, logistics, & delivery","Eastern Bell Capital 32, SDIC CMC Investment Management, Trustbridge Partners"
380,407,BloomReach,$2.2,2/23/2022,United States,Mountain View,Artificial intelligence,"Bain Capital Ventures, Sixth Street Growth, Lightspeed Venture Partners"
381,408,Motif FoodWorks,$2.20,6/16/2021,United States,Boston,Consumer & retail,"General Atlantic, Breakthrough Energy Ventures, Viking Global Investors"
382,409,Huaqin Telecom Technology,$2.19,10/8/2019,China,Shanghai,Mobile & telecommunications,"Zhangjiang Haocheng Venture Capital, Walden International, Intel Capital"
383,410,Accelerant,$2.19,1/12/2022,United Kingdom,Colchester,Other,"Deer Park Road, Altamont Capital Partners, Eldridge"
384,411,Hesai Tech,$2.18,8/1/2020,China,Shanghai,Artificial intelligence,"Lightspeed China Partners, Baidu Ventures, Qiming Venture Partners"
385,412,YITU Technology,$2.17,3/8/2018,China,Shanghai,Artificial intelligence,"Sequoia Capital China, Banyan Capital"
386,413,Addepar,$2.17,6/15/2021,United States,Mountain View,Fintech,"8VC, D1 Capital Partners, Sway Ventures"
387,414,Qualia,$2.17,12/21/2020,United States,San Francisco,Fintech,"8VC, Menlo Ventures, Tiger Global Management"
388,415,Neo4j,$2,6/17/2021,United States,San Mateo,Data management & analytics,"Eight Roads Ventures, One Peak Partners, Creandum"
389,416,CloudWalk,$2.15,9/8/2021,Brazil,Sao Paulo,Fintech,"Plug and Play Ventures, Valor Capital Group, DST Global"
390,419,Eightfold.ai,$2.1,10/27/2020,United States,Santa Clara,Internet software & services,"Foundation Capital, Institutional Venture Partners, General Catalyst"
391,421,ReCharge,$2.1,5/6/2021,United States,Los Angeles,Fintech,"ICONIQ Growth, Bain Capital Ventures, Summit Partners"
392,422,Moveworks,$2.1,6/30/2021,United States,Mountain View,Artificial intelligence,"Lightspeed Venture Partners, Sapphire Ventures, Kleiner Perkins Caufield & Byers"
393,423,Medable,$2.1,10/26/2021,United States,Palo Alto,Internet software & services,"GSR Ventures, Sapphire Ventures, Streamlined Ventures"
394,424,GoCardless,$2.1,2/8/2022,United Kingdom,London,Fintech,"Accel, Passion Capital, Balderton Capital"
395,425,Forto,$2.1,6/21/2021,Germany,Berlin,"Supply chain, logistics, & delivery","Cherry Ventures, Northzone Ventures, Global Founders Capital"
396,426,Jeeves,$2.1,3/14/2022,United States,Orlando,Fintech,"Tencent Holdings, CRV, Clocktower Technology Ventures"
397,427,Babel Finance,$2,5/25/2022,Hong Kong,Hong Kong,Fintech,"Dragonfly Capital, BAI Capital, 10T Fund"
398,428,Trendy Group International,$2,2/13/2012,Hong Kong,Kowloon,Consumer & retail,L Capital Partners
399,429,Avant,$2,12/17/2012,United States,Chicago,Artificial intelligence,"RRE Ventures, Tiger Global, August Capital"
400,430,Tubatu.com,$2,3/9/2015,China,Shenzhen,E-commerce & direct-to-consumer,"Sequoia Capital China, Matrix Partners China, 58.com"
401,431,BlaBlaCar,$2,9/16/2015,France,Paris,Auto & transportation,"Accel Partners, Index Ventures, Insight Venture Partners"
402,432,HuiMin,$2,9/5/2016,China,Beijing,E-commerce & direct-to-consumer,"Zheshang Venture Capital, GP Capital, Western Capital Management"
403,433,Quora,$2,4/21/2017,United States,Mountain View,Internet software & services,"Y Combinator, Matrix Partners, Benchmark"
404,434,Improbable,$1,5/11/2017,United Kingdom,London,Other,"Andreessen Horowitz, SoftBank Group, Temasek Holdings"
405,435,Preferred Networks,$2,5/17/2018,Japan,Tokyo,Artificial intelligence,"Toyota Motor Corporation, Mizuho Financial Group, FANUC"
406,436,Formlabs,$2,8/1/2018,United States,Somerville,Hardware,"Pitango Venture Capital, DFJ Growth Fund, Foundry Group"
407,437,4Paradigm,$2,12/19/2018,China,Beijing,Artificial intelligence,"Sequoia Capital China, China Construction Bank, Bank of China"
408,438,Calm,$2,2/6/2019,United States,San Francisco,Consumer & retail,"Insight Venture Partners, TPG Growth, Sound Ventures"
409,439,Kaseya,$2,3/27/2019,United States,Miami,Cybersecurity,"Insight Partners, TPG Alternative & Renewable Technologies, Ireland Strategic Investment Fund"
410,440,Mafengwo,$2,5/23/2019,China,Beijing,Travel,"Qiming Venture Partners, Capital Today, General Atlantic"
