,Unnamed: 0,Company,Valuation ($B),Date Joined,Country,City,Industry,Select Investors
411,441,Druva,$2,6/20/2019,United States,Sunnyvale,Data management & analytics,"Nexus Venture Partners, Tenaya Capital, Sequoia Capital"
412,442,Kujiale,$2,10/25/2019,China,Hangzhou,Internet software & services,"GGV Capital, IDG Capital, Linear Venture"
413,443,AppsFlyer,$2,1/21/2020,United States,San Francisco,Mobile & telecommunications,"Magma Venture Partners, Pitango Venture Capital, Qumra Capital"
414,444,Keep,$2,5/19/2020,China,Beijing,Mobile & telecommunications,"Bertelsmann Asia Investments, GGV Capital, Morningside Venture Capital"
415,445,Redis Labs,$2,8/25/2020,United States,Mountain View,Data management & analytics,"Viola Ventures, Dell Technologies Capital, Bain Capital Ventures"
416,446,Xingyun Group,$2,9/24/2020,China,Shenzhen,E-commerce & direct-to-consumer,"Matrix Partners China, Eastern Bell Capital, Hongtai Capital Holdings"
417,447,Unqork,$2,10/6/2020,United States,New York,Fintech,"Blackrock, capitalG, World Lab Innovation"
418,448,Virta Health,$2,12/2/2020,United States,San Francisco,Health,"Caffeinated Capital, Obvious Ventures, Venrock"
419,449,ISN,$2,12/17/2020,United States,Dallas,"Supply chain, logistics, & delivery",Blackstone
420,450,Earnix,$2,2/21/2021,Israel,Giv'atayim,Fintech,"Jerusalem Venture Partners, Israel Growth Partners, Insight Partners"
421,451,Guoquan Shihui,$2,3/17/2021,China,Shanghai,Consumer & retail,"Tiantu Capital, CMB International Capital, Vision Knight Capital"
422,452,Clearco,$2,4/20/2021,Canada,Toronto,Fintech,"Highland Capital Partners, Oak HC/FT Partners, Emergence Capital Partners"
423,453,Hive,$2,4/21/2021,United States,San Francisco,Artificial intelligence,"Tomales Bay Capital, Bain & Company, General Catalyst"
424,454,KRY,$2,4/27/2021,Sweden,Stockholm,Health,"Index Ventures, Creandum, Accel"
425,455,Kajabi,$2,5/4/2021,United States,Irvine,Internet software & services,"Meritech Capital Partners, Tiger Global Management, Spectrum Equity"
426,456,Ethos,$2.7,5/11/2021,United States,San Francisco,Fintech,"Sequoia Capital, Google Ventures, Accel"
427,457,PayFit,$2.1,1/6/2022,United Kingdom,London,Fintech,"Accel, frst, Kima Ventures"
428,458,Beisen,$2,5/11/2021,China,Beijing,Internet software & services,"Matrix Partners China, Sequoia Capital China, Genesis Capital"
429,459,Pipe,$2,5/19/2021,United States,Miami,Fintech,"next47, MaC Venture Capital, FinVC"
430,460,Iterable,$2,6/15/2021,United States,San Francisco,Internet software & services,"CRV, Blue Cloud Ventures, Index Ventures"
431,461,Bunq,$2,6/18/2021,Netherlands,Amsterdam,Fintech,Undisclosed
432,462,Clip,$2,6/10/2021,Mexico,Mexico City,Fintech,"Alta Ventures Mexico, General Atlantic, SoftBank Group"
433,463,Loggi,$2,6/5/2019,Brazil,Sao Paulo,"Supply chain, logistics, & delivery","Qualcomm Ventures, SoftBank Group. Monashees+"
434,464,MURAL,$2,7/20/2021,United States,San Francisco,Internet software & services,"Insight Partners, Tiger Global Management, Gradient Ventures"
435,465,Pagaya,$2,6/17/2020,Israel,Tel Aviv,Fintech,"Oak HC/FT Partners, GF Investments, Harvey Golub Family Office"
436,466,OCSiAl,$2,3/4/2019,Luxembourg,Leudelange,Other,"A&NN, Rusnano"
437,467,XtalPi,$2,8/11/2021,China,Shenzhen,Artificial intelligence,"Tencent Holdings, 5Y Capital, Sequoia Capital China"
438,468,Divvy Homes,$2,8/13/2021,United States,San Francisco,Fintech,"Andreessen Horowitz, Caffeinated Capital, SciFi VC"
439,469,Apeel Sciences,$2,5/26/2020,United States,Goleta,Other,"Upfront Ventures, Tao Capital Partners, Andreessen Horowitz"
440,470,Opay,$2,8/23/2021,Nigeria,Lagos,Fintech,"Sequoia Capital China, Source Code Capital, Redpoint Ventures China"
441,471,Aviatrix,$2,9/8/2021,United States,Santa Clara,Internet software & services,"Ignition Partners, Formation 8, CRV"
442,472,SmartNews,$2,8/5/2019,Japan,Tokyo,Mobile & telecommunications,"Japan Post Capital, Globis Capital Partners, Atomico"
443,473,Misfits Market,$2,4/21/2021,United States,Pennsauken,E-commerce & direct-to-consumer,"Accel, D1 Capita Partners, Greenoaks Capital Management"
444,474,Spring Health,$2,9/16/2021,United States,New York,Health,"Rethink Impact, Work-Bench, RRE Ventures"
445,475,Black Sesame Technologies,$2,9/22/2021,China,Shanghai,Artificial intelligence,"Northern Light Venture Capital, Xiaomi, FutureX Capital"
446,476,Advance Intelligence Group,$2,9/23/2021,Singapore,,Artificial intelligence,"Vision Plus Capital, GSR Ventures, ZhenFund"
447,477,Modern Treasury,$2,10/6/2021,United States,San Francisco,Fintech,"Benchmark, Altimeter Capital, Quiet Capital"
448,478,Magic Leap,$2,10/21/2014,United States,Plantation,Hardware,"Obvious Ventures, Qualcomm Ventures, Andreessen Horowitz"
449,479,Tier,$2,10/25/2021,Germany,Berlin,Travel,"Northzone Ventures, White Star Capital, Novator Partners"
450,480,ClickHouse,$2,10/28/2021,United States,Portola Valley,Data management & analytics,"Lightspeed Venture Partners, Almaz Capital Partners, Altimeter Capital"
451,481,Mynt,$2,11/1/2021,Philippines,Taguig City,Fintech,"Insight Partners, Warburg Pincus, Ayala Corporation"
452,482,Everlaw,$2,3/10/2020,United States,Oakland,Internet software & services,"K9 Ventures, Menlo Ventures, Andreessen Horowitz"
453,483,Zilch,$2,11/10/2021,United Kingdom,London,Fintech,"Gauss Ventures, Ventura Capital, dmg ventures"
454,484,VerbIT,$2,6/8/2021,United States,New York,Artificial intelligence,"ClalTech, Vertex Ventures, Oryzn Capital"
455,485,StarkWare,$8,11/17/2021,Israel,Netanya,Cybersecurity,"Sequoia Capital, Paradigm, Pantera Capital"
456,486,Netlify,$2,11/17/2021,United States,San Francisco,Internet software & services,"Andreessen Horowitz, Kleiner Perkins Caufield & Byers, EQT Ventures"
457,487,SWORD Health,$2,11/22/2021,United States,New York,Health,"Khosla Ventures, Green Innovations, Founders Fund"
458,488,LTK,$2,11/22/2021,United States,Dallas,Internet software & services,"SoftBank Group, Maverick Capital"
459,489,Trax,$2,7/22/2019,Singapore,,Artificial intelligence,"Hopu Investment Management, Boyu Capital, DC Thomson Ventures"
460,490,Exotec,$2,1/17/2022,France,Croix,Hardware,"Breega Capital, Iris Capital, 360 Capital Partners"
461,491,Dremio,$2,1/6/2021,United States,Santa Clara,Data management & analytics,"Lightspeed Venture Partners, Redpoint Ventures, Norwest Venture Partners"
462,492,Akulaku,$2,2/15/2022,Indonesia,Jakarta,E-commerce & direct-to-consumer,"DCM Ventures, IDG Capital, Siam Commercial Bank"
463,493,Cloudinary,$2,2/15/2022,United States,Santa Clara,Internet software & services,"Blackstone, Bessemer Venture Partners"
464,494,Lunar,$2,7/12/2021,Denmark,Aarhus,Fintech,"SEED Capital, Greyhound Capital, Socii Capital"
465,496,Salsify,$2,4/13/2022,United States,Boston,Internet software & services,"Matrix Partners, North Bridge Venture Partners, Venrock"
466,497,CertiK,$2,3/31/2022,United States,New York,Cybersecurity,"Tiger Global Management, Lightspeed Venture Partners, Hillhouse Capital Management"
467,498,ROX Motor,$2,4/29/2022,China,Shanghai,Auto & transportation,"Sequoia Capital China, IDG Capital, Qiming Venture Partners"
468,499,Hugging Face,$2,5/9/2022,United States,New York,Artificial intelligence,"Betaworks Ventures, Addition, Lux Capital"
469,500,Devo Technology,$2,10/26/2021,United States,Cambridge,Data management & analytics,"Insight Partners, Kibo Ventures, Bessemer Venture Partners"
470,501,Rimac Automobili,$2,6/1/2022,Croatia,Sveta Nedelja,Auto & transportation,"Porsche, InvestIndustrial, SoftBank Group"
471,502,Ankorstore,$1.98,1/10/2022,France,Paris,E-commerce & direct-to-consumer,"Global Founders Capital, Aglae Ventures, Alven Capital"
472,503,Fenbi Education,$1.95,2/7/2021,China,Beijing,Edtech,"Trustbridge Partners, Hony Capital, IDG Capital"
473,504,Rokt,$1.95,12/16/2021,United States,New York,Internet software & services,"Square Peg Capital, TDM Growth Partners, Tiger Global Management"
474,505,InVision,$1.9,11/1/2017,United States,New York,Internet software & services,"FirstMark Capital, Tiger Global Management, ICONIQ Capital"
475,506,eDaili,$1.9,2/1/2019,China,Shanghai,E-commerce & direct-to-consumer,"K2VC, Lightspeed China Partners, Sky9 Capital"
476,507,MX Technologies,$1.9,1/13/2021,United States,Lehi,Fintech,"Point72 Ventures, Pelion Venture Partners, Commerce Ventures"
477,508,Aledade,$1.9,1/19/2021,United States,Bethesda,Health,"Venrock, CVF Capital Partners, ARCH Venture Partners"
478,510,Acorns,$1.9,3/9/2022,United States,Irvine,Fintech,"e.ventures, Bain Capital Ventures, Greycroft"
479,511,Roofstock,$1.94,3/10/2022,United States,Oakland,Fintech,"Khosla Ventures, Bain Capital Ventures, Lightspeed Venture Partners"
480,512,thatgamecompany,$1.94,3/3/2022,United States,Los Angeles,Internet software & services,"Benchmark, Sequoia Capital, TPG Capital"
481,513,ConcertAI,$1.9,3/29/2022,United States,Boston,Artificial Intelligence,"Sixth Street Partners, Declaration Partners, Maverick Ventures Israel"
482,514,Material Bank,$1.9,5/6/2022,United States,Boca Raton,E-commerce & direct-to-consumer,"Bain Capital Ventures, SoftBank Group, Fifth Wall Ventures"
483,515,Volocopter,$1.87,3/4/2022,Germany,Bruchsal,Auto & transportation,"btov Partners, Geely, Intel Capital"
484,516,ENOVATE,$1.85,4/15/2019,China,Shanghai,Auto & transportation,Automobile Industry Guidance Fund
485,517,CFGI,$1.85,9/15/2021,United States,Boston,Fintech,"The Carlyle Group, CVC Capital Partners"
486,518,Retool,$1.85,12/22/2021,United States,San Francisco,Internet software & services,Sequoia Capital
487,519,ZocDoc,$1.8,8/20/2015,United States,New York,Health,"Founders Fund, Khosla Ventures, Goldman Sachs"
488,520,Diamond Foundry,$1.8,3/29/2021,United States,San Francisco,Other,"Fashion Tech Lab, Fidelity Investments, Vast Ventures"
489,521,FullStory,$1.8,8/4/2021,United States,Atlanta,Internet software & services,"Google Ventures, Kleiner Perkins Caufield & Byers, Stripes Group"
490,522,Lightricks,$1.8,7/31/2019,Israel,Jerusalem,Artificial intelligence,"Viola Ventures, Insight Partners, ClalTech, Goldman Sachs"
491,523,Opentrons,$1.8,9/23/2021,United States,New York,Hardware,"SOSV, Khosla Ventures, Lerer Hippeau"
492,525,Cambrian BioPharma,$1.79,10/26/2021,United States,Brooklyn,Health,"Future Ventures, Apeiron Investment Group, Moore Capital Management"
493,526,AIWAYS,$1.78,4/16/2018,China,Shanghai,Auto & transportation,"Jiangsu Sha Steel Group, Shanghai Puyin Industry, Funa Yuanchuang Technology"
494,527,Trulioo,$1.75,6/7/2021,Canada,Vancouver,Cybersecurity,"Blumberg Capital, American Express Ventures, BDC Venture Capital"
495,529,Crusoe,$1.75,4/21/2022,United States,Denver,Internet software & services,"Bain Capital Ventures, Founders Fund, Winklevoss Capital"
496,530,Orca Security,$1.8,3/23/2021,United States,Portland,Cybersecurity,"YL Ventures, Redpoint Ventures, GGV Capital"
497,531,Apus Group,$1.73,1/16/2015,China,Beijing,Mobile & telecommunications,"Redpoint Ventures, QiMing Venture Partners, Chengwei Capital"
498,532,Harry's,$1.7,2/16/2018,United States,New York,Consumer & retail,"Thrive Capital, Tiger Global Management, Temasek"
499,533,PAX,$1.7,10/22/2018,United States,San Francisco,Consumer & retail,"Tao Capital Partners, Global Asset Capital, Tiger Global Management"
500,534,DispatchHealth,$1.7,3/3/2021,United States,Denver,Health,"Alta Partners, Questa Capital, Echo Health Ventures"
501,535,Saliogen Therapeutics,$1.7,12/7/2021,United States,Cambridge,Health,"PBM Capital Group, T. Rowe Price, D1 Capital Partners"
502,536,Pax8,$1.7,4/11/2022,United States,Greenwood Village,Internet software & services,"Liberty Global Ventures, Sageview Capital, Blue Cloud Ventures"
503,537,Multiverse,$1.7,6/8/2022,United Kingdom,London,Edtech,"Lightspeed Venture Partners, Google Ventures, General Catalyst"
504,538,Tessera Therapeutics,$1.69,4/19/2022,United States,Cambridge,Health,"Altitude Life Science Ventures, SoftBank Group, Alaska Permanent Fund"
505,539,Unite Us,$1.6,3/16/2021,United States,New York,Health,"Insight Partners, Sequoia Capital, Index Ventures"
506,540,CircleCI,$1.7,5/11/2021,United States,San Francisco,Internet software & services,"Threshold Ventures, Baseline Ventures, Harrison Metal"
507,541,Wave,$1.7,9/7/2021,Senegal,Dakar,Fintech,"Stripe, Founders Fund, Partech Partners"
508,542,Vestiaire Collective,$1.7,3/1/2021,France,Paris,E-commerce & direct-to-consumer,"Eurazeo, IDInvest Partners, Balderton Capital"
509,543,Dragos,$1.7,10/28/2021,United States,Hanover,Cybersecurity,"DataTribe, Energy Impact Partners, AllegisCyber Capital"
510,544,Reltio,$1.7,11/4/2021,United States,Redwood City,Data management & analytics,"Crosslink Capital, .406 Ventures, Sapphire Ventures"
511,545,H2O.ai,$1.7,11/7/2021,United States,Mountain View,Artificial intelligence,"Nexus Venture Partners, Transamerica Ventures, Crane Venture Partners"
512,546,ZenBusiness,$1.7,11/9/2021,United States,Austin,Fintech,"Greycroft, Lerer Hippeau, Geekdom Fund"
513,547,Carsome,$1.7,7/12/2021,Malaysia,Selangor,E-commerce & direct-to-consumer,"Gobi Partners, 500 Startups, Ondine Capital"
514,548,Productboard,$1.7,2/2/2022,United States,San Francisco,Internet software & services,"Index Ventures, Kleiner Perkins Caufield & Byers, Bessemer Venture Partners"
515,549,Spotter,$1.7,2/16/2022,United States,Los Angeles,Fintech,"SoftBank Group, Access Industries, Crossbeam Venture Partners"
516,550,Hibob,$1.65,10/12/2021,Israel,Tel Aviv,Internet software & services,"Bessemer Venture Partners, Eight Roads Ventures, Battery Ventures"
517,551,Optimism,$1.65,3/17/2022,United States,San Francisco,Internet software & services,"Paradigm, Huobi Ventures, Andreessen Horowitz"
518,552,Trader Interactive,$1.63,5/12/2021,United States,Norfolk,Other,Carsales
519,553,Jusfoun Big Data,$1.62,7/9/2018,China,Beijing,Data management & analytics,"Boxin Capital, DT Capital Partners, IDG Capital"
520,554,Transcarent,$1.62,1/11/2022,United States,San Francisco,Health,"Alta Partners, General Catalyst, Jove Equity Partners"
521,556,Zhubajie,$1.61,6/16/2015,China,Chongqing,Internet software & services,"Cybernaut Growth Fund, IDG Capital"
522,557,solarisBank,$1.65,7/13/2021,Germany,Berlin,Fintech,"Yabeo Capital, SBI Investment, Vulcan Capital"
523,558,Infinidat,$1.6,4/29/2015,United States,Waltham,Hardware,"TPG Growth, Goldman Sachs"
524,559,Afiniti,$1.6,4/14/2017,Bermuda,Hamilton,Artificial intelligence,GAM Holding
525,560,Cao Cao Mobility,$1.6,1/17/2018,China,Hangzhou,Auto & transportation,"People Electrical Appliance Group China, Zhongrong International Trust"
526,561,Verkada,$1.6,1/29/2020,United States,San Mateo,Cybersecurity,"next47, First Round Capital, Sequoia Capital"
527,562,Clari,$2.6,3/3/2021,United States,Sunnyvale,Internet software & services,"Sequoia Capital, Bain Capital Ventures, enaya Capital"
528,563,Tonal,$1.6,3/31/2021,United States,San Francisco,E-commerce & direct-to-consumer,"Mayfield Fund, Shasta Ventures, L Catterton"
529,564,Clio,$1.6,4/27/2021,Canada,Burnaby,Internet software & services,"OMERS Private Equity, T. Rowe Price, Technology Crossover Ventures"
530,565,SafetyCulture,$1.6,5/3/2021,Australia,Sydney,Internet software & services,"Blackbird Ventures, IndexVentures, Tiger Global Management"
531,566,Monte Carlo,$1.6,5/24/2022,United States,San Francisco,Artificial intelligence,"GGV Capital, Accel, Redpoint Ventures"
532,567,Cresta,$1.6,3/17/2022,United States,San Francisco,Artificial Intelligence,"Andreessen Horowitz, Greylock Partners, Sequoia Capital"
533,568,Extend,$1.36,5/18/2021,United States,San Francisco,Fintech,"GreatPoint Ventures, Meritech Capital Partners, PayPal Ventures"
534,569,Generate Biomedicines,$1.36,11/18/2021,United States,Cambridge,Health,"Altitude Life Science Ventures. T. Rowe Price, Morningside Venture Partners"
535,570,Cognite,$1.5,5/19/2021,Norway,Lysaker,Data management & analytics,"Technology Crossover Ventures, Accel, Aker"
536,571,ASAPP,$1.6,5/19/2021,United States,New York,Artificial intelligence,"March Capital Partners, HOF Capital, Emergence Capital Partners"
537,572,SmartHR,$1.6,6/8/2021,Japan,Tokyo,Fintech,"BEENEXT, World Innovation Lab, Light Street Capital"
538,573,Mercury,$1.6,7/3/2021,United States,San Francisco,Fintech,"Andreessen Horowitz, Coatue Management, Clocktower Technology Ventures"
539,574,HomeLight,$1.6,9/2/2021,United States,San Francisco,Fintech,"Zeev Ventures, Menlo Ventures,Crosslink Capital"
540,575,Truepill,$1.6,10/27/2021,United States,Hayward,Health,"Initialized Capital, Sound Ventures, TI Platform Management"
541,576,ezCater,$1.6,4/2/2019,United States,Boston,"Supply chain, logistics, & delivery","Insight Venture Partners, ICONIQ Capital, Launchpad Venture Group"
542,577,Wayflyer,$1.6,2/1/2022,Ireland,Dublin,Fintech,"QED Investors, DST Global, Left Lane Capital"
543,578,Capitolis,$1.6,3/22/2022,United States,New York,Fintech,"Sequoia Capital, Index Ventures, S Capital"
544,579,Nord Security,$1.6,4/7/2022,Lithuania,Vilnius,Cybersecurity,"General Catalyst, BaltCap, Novator Partners"
545,580,Vanta,$1.6,6/7/2022,United States,San Francisco,Cybersecurity,"Craft Ventures, Sequoia Capital, Verissimo Ventures"
546,581,Promasidor Holdings,$1.59,11/8/2016,South Africa,Bryanston,Consumer & retail,"IFC, Ajinomoto"
547,582,ICON 3D,$1.57,2/18/2022,United States,Austin,Hardware,"Moderne Ventures, Oakhouse Partners, Bjarke Ingels Group"
548,583,Baiwang,$1.55,3/25/2019,China,Beijing,Fintech,"Guozhong Venture Capital Management, Shenzhen Capital Group, Oriental Fortune Capital"
549,584,Iluvatar CoreX,$1.55,3/1/2021,China,Shanghai,Hardware,"Centurium Capital, Cedarlake Capital, Unicom Innovation Venture Capital"
550,585,Wenheyou,$1.55,4/17/2021,China,Hunan,Other,"Sequoia Capital China, Warburg Pincus, IDG Capital"
551,586,Kitopi,$1.55,7/1/2021,United Arab Emirates,Dubai,"Supply chain, logistics, & delivery","CE-Ventures, BECO Capital, Nordstar"
552,587,Loom,$1.53,5/20/2021,United States,San Francisco,Internet software & services,"Kleiner Perkins Caufield & Byers, Sequoia Capital, General Catalyst"
553,588,Ximalaya FM,$1.52,9/22/2017,China,Shanghai,Mobile & telecommunications,"China Creation Ventures, Sierra Ventures, Xingwang Investment Management"
554,589,Carzone,$1.52,3/1/2019,China,Jiangsu,E-commerce & direct-to-consumer,"Alibaba Group,Co-Stone Venture Capital, Buhuo Venture Capital"
555,590,Mu Sigma,$1.5,2/7/2013,United States,Northbrook,Data management & analytics,"Sequoia Capital, General Atlantic"
556,591,Kushki,$1.5,6/7/2022,Ecuador,Quito,Fintech,"Clocktower Technology Ventures, DILA Capital, Kaszek Ventures"
557,592,TuJia,$1.5,6/17/2015,China,Beijing,Travel,"GGV Capital, QiMing Venture Partnersl"
558,593,Mofang Living,$1.5,4/13/2016,China,Shanghai,E-commerce & direct-to-consumer,"Warburg Pincus, Aviation Industry Corporation of China"
559,594,Gett,$1.5,5/24/2016,United Kingdom,London,Auto & transportation,"Volkswagen, Access Industries, Vostok New Ventures"
560,595,DT Dream,$1.5,6/8/2017,China,Hangzhou,Data management & analytics,"Alibaba Group, China Everbright Investment Management, Yinxinggu Capital"
561,596,Changingedu,$1.5,10/30/2017,China,Shanghai,Edtech,"Trustbridge Partners, IDG Capital, Sequoia Capital China"
562,597,XiaoZhu,$1.5,11/1/2017,China,Beijing,Travel,"Morningside Ventures, Capital Today, JOY Capital"
563,598,JOLLY Information Technology,$1.5,5/29/2018,China,Hangzhou,E-commerce & direct-to-consumer,"Legend Capital, CDH Investments, Sequoia Capital China"
564,599,Yijiupi,$1.5,9/20/2018,China,Beijing,Consumer & retail,"Source Code Capital, Meituan Dianping, Tencent Holdings"
565,600,Cambridge Mobile Telematics,$1.5,12/19/2018,United States,Cambridge,Mobile & telecommunications,SoftBank Group
566,601,Collective Health,$1.5,6/17/2019,United States,San Francisco,Fintech,"New Enterprise Associates, Founders Fund, Google Ventures"
567,602,Strava,$1.5,11/16/2020,United States,San Francisco,Internet software & services,"Jackson Square Ventures, Madrone Capital Partners, Sequoia Capital"
568,603,Zenoti,$1.5,12/15/2020,United States,Bellevue,Internet software & services,"Norwest Venture Partners, Accel, Tiger Global Management"
569,604,K Health,$1.5,1/19/2021,United States,New York,Health,"Max Ventures, Mangrove Capital Partners, 14W"
570,605,Uplight,$1.5,3/3/2021,United States,Boulder,Other,"Rubicon Technology Partners, Max Ventures, Inclusive Capital Partners"
571,606,ID.me,$1.5,3/19/2021,United States,McLean,Cybersecurity,"Moonshots Capital, BoxGroup, Blu Venture Investors"
572,607,Snapdocs,$1.5,5/25/2021,United States,San Francisco,Fintech,"Sequoia Capital, Y Combinator, F-Prime Capital"
573,608,Chipper Cash,$2,5/31/2021,United States,San Francisco,Fintech,"Deciens Capital, Bezos Expeditions, 500 Startups"
574,609,Ledger,$1.5,6/10/2021,France,Paris,Hardware,"Digital Currency Group, Draper Esprit, Korelya Capital"
575,610,Next Silicon,$1.5,6/14/2021,Israel,Tel Aviv,Hardware,"Amiti Ventures, Playground Global, Aleph"
576,611,YunQuNa,$1.5,6/29/2021,China,Shanghai,"Supply chain, logistics, & delivery","Source Code Capital, Coatue Management, DCM Ventures"
577,612,impact.com,$1.5,7/13/2021,United States,Santa Barbara,Internet software & services,"Redpoint Ventures, Providence Equity Partners, Silversmith Capital Partners"
578,613,SmartRecruiters,$1.5,7/20/2021,United States,San Francisco,Internet software & services,"Mayfield Fund, Insight Partners, Rembrandt Venture Partners"
579,614,NotCo,$1.5,7/26/2021,Chile,Santiago,Artificial Intelligence,"Kaszek Ventures, SOSV, Tiger Global Management"
580,615,Culture Amp,$1.5,7/29/2021,Australia,Richmond,Internet software & services,"Felicis Ventures, Index Ventures, Blackbird Ventures"
581,616,TaxBit,$1.5,8/4/2021,United States,Draper,Fintech,"Insight Partners, Coinbase Ventures, PayPal Ventures"
582,617,Pacaso,$1.5,3/24/2021,United States,Cincinnati,Fintech,"Global Founders Capital, Shea Ventures, Greycroft"
583,618,1047 Games,$1.5,9/14/2021,United States,Zephyr Cove,Internet software & services,"VGames, Lakestar, Galaxy Interactive"
584,619,Matillion,$1.5,9/15/2021,United Kingdom,Altrincham,Data management & analytics,"Scale Venture Partners, Sapphire Ventures, Battery Ventures"
585,620,Persona,$1.5,9/15/2021,United States,San Francisco,Cybersecurity,"Coatue Management, Index Ventures, Founders Fund"
586,621,Whatnot,$1.5,9/16/2021,United States,Marina del Rey,E-commerce & direct-to-consumer,"Y Combinator, Andreessen Horowitz, Wonder Ventures"
587,622,Ascend Money,$1.5,9/27/2021,Thailand,Bangkok,Fintech,"Ant Group, Charoen Pokphand Group, Bow Wave Capital"
588,623,Andela,$1.5,9/29/2021,United States,New York,Internet software & services,"Spark Capital, Google Ventures, CRE Venture Capital"
589,624,Built,$1.5,9/30/2021,United States,Nashville,Internet software & services,"Nyca Partners, Index Ventures, Technology Crossover Ventures"
590,625,candy.com,$1.5,10/21/2021,United States,New York,Fintech,"Insight Partners, Softbank Group, Connect Ventures"
591,626,CoinList,$1.5,10/15/2021,United States,San Francisco,Fintech,"Accomplice, Polychain Capital, GoldenTree Asset Management"
592,627,Lusha,$1.5,11/10/2021,United States,New York,Internet software & services,"PSG, ION Crossover Partners"
593,629,Solugen,$1.5,9/10/2021,United States,Houston,Other,"Fifty Years Fund, Refactor Capital, Temasek"
594,630,Olist,$1.5,12/15/2021,Brazil,Curitiba,E-commerce & direct-to-consumer,"Redpoint e.ventures, Valor Capital Group, SoftBank Latin America Fund"
595,631,Paradox,$1.5,12/27/2021,United States,Scottsdale,Internet software & services,"Brighton Park Capital, Blue Cloud Ventures, Workday Ventures"
596,632,Airbyte,$1.5,12/17/2021,United States,San Francisco,Internet software & services,"Accel, Benchmark, SV Angel"
597,633,StoreDot,$1.5,1/4/2022,Israel,Herzliya,Other,"Samsung Ventures, SingulariTeam, BP Ventures"
598,634,Il Makiage,$1.5,1/10/2022,United States,New York,E-commerce & direct-to-consumer,"L Catterton, Franklin Templeton, First Light Capital Group"
599,635,Spendesk,$1.5,1/18/2022,France,Paris,Fintech,"Index Ventures, Eight Roads Ventures, General Atlantic"
600,636,Veriff,$1.5,1/26/2022,Estonia,Tallinn,Artificial intelligence,"Accel, Institutional Venture Partners, Tiger Global Management"
601,637,Athelas,$1.5,1/31/2022,United States,Mountain View,Health,"Sequoia Capital, General Catalyst, Human Capital"
602,639,Veho,$1.5,12/21/2021,United States,Boulder,"Supply chain, logistics, & delivery","General Catalyst, Origin Ventures, Fontinalis Partners"
603,640,Temporal,$1.5,2/16/2022,United States,Bellevue,Internet software & services,"Amplify Partners, Addition, Madrona Venture Group"
604,641,Fabric,$1.5,2/24/2022,United States,Bellevue,E-commerce & direct-to-consumer,"Redpoint Ventures, Norwest Venture Partners, Sierra Ventures"
605,642,Zeta,$1.5,5/24/2021,United States,San Francisco,Fintech,"Sodexo Ventures, SoftBank Group"
606,643,Boba,$1.5,4/5/2022,United States,San Francisco,Fintech,"DeFi Technologies, Hypersphere Ventures, M13"
607,644,Upside,$1.5,4/26/2022,United States,DC,Mobile & telecommunications,"Bessemer Venture Partners, Builders VC, General Catalyst"
608,645,Mashgin,$1.5,5/9/2022,United States,Palo Alto,Artificial intelligence,"New Enterprise Associates, Matrix Partmers, Susa Ventures"
609,646,Dock,$1.5,5/12/2022,Brazil,Sao Paulo,Fintech,"Viking Global Investors, Riverwood Capital, Lightrock"
610,647,Prometheus,$1.50,9/23/2021,United States,Santa Cruz,Other,"BMW i Ventures, Metaplanet, Maersk Growth"
611,648,Yipin Shengxian,$1.49,3/11/2019,China,Hefei,E-commerce & direct-to-consumer,"Eastern Bell Capital, Capital Today, Longzhu Capital"
612,649,Bordrin Motors,$1.48,6/3/2019,China,Shanghai,Auto & transportation,"China Grand Prosperity Investment, CSC Group"
613,650,Shukun Technology,$1.46,8/16/2021,China,Beijing,Artificial Intelligence,"Marathon Venture Partners, Huagai Capital, China Creation Ventures"
614,651,Coocaa,$1.45,3/16/2018,China,Shenzhen,Hardware,"Baidu, Tencent Holdings"
