,Unnamed: 0,Company,Valuation ($B),Date Joined,Country,City,Industry,Select Investors
817,870,Jiuxian,$1.05,7/30/2015,China,Beijing,E-commerce & direct-to-consumer,"Sequoia Capital China, Rich Land Capital, Merrysunny Wealth"
818,871,Instabase,$1.05,10/21/2019,United States,San Francisco,Data management & analytics,"New Enterprise Associates, Greylock Partners, Andreessen Horowitz"
819,872,Sendbird,$1.05,4/6/2021,United States,San Mateo,Mobile & telecommunications,"FundersClub, Y Combinator, Tiger Global Management"
820,873,Density,$1.05,11/10/2021,United States,San Francisco,Hardware,"Founders Fund, Upfront Ventures, 01 Advisors"
821,874,Mixpanel,$1.05,11/15/2021,United States,San Francisco,Internet software & services,"Bain Capital Tech Opportunities, Andreessen Horowitz, Sequoia Capital"
822,875,Aprogen,$1.04,5/31/2019,South Korea,Seongnam-Si,Health,"Lindeman Asia Investment, Nichi-Iko Pharmaceutical"
823,876,OrCam Technologies,$1.03,2/20/2018,Israel,Jerusalem,Artificial intelligence,"Intel Capital, Aviv Venture Capital"
824,877,Ample,$1.02,11/11/2021,United States,San Francisco,Hardware,"Shell Ventures, Blackstone, Moore Strategic Ventures"
825,878,Leap Motor,$1.01,11/20/2018,China,Hangzhou,Auto & transportation,"Sequoia Capital China, Gopher Asset Management, Shanghai Electric Group"
826,879,Wheel,$1.01,1/19/2022,United States,Austin,Health,"Silverton Partners, Tusk Ventures, CRV"
827,880,TransferMate,$1,5/22/2022,Ireland,Kilkenny,Fintech,Railway Pension Trustee Co. Ltd.
828,881,Lookout,$1,10/10/2013,United States,San Francisco,Cybersecurity,"Accel Partners, Greylock Partners, Lowercase Capital"
829,882,Perimeter 81,$1,6/6/2022,Israel,Tel Aviv,Cybersecurity,"Insight Partners, Toba Capital, Spring Ventures"
830,884,TechStyle Fashion Group,$1,8/29/2014,United States,El Segundo,E-commerce & direct-to-consumer,"Matrix Partners, Passport Capital, Rho Ventures"
831,886,LinkSure Network,$1,1/1/2015,China,Shanghai,Mobile & telecommunications,
832,887,Red Ventures,$1,1/7/2015,United States,Fort Mill,Other,"Silver Lake Partners, General Atlantic"
833,888,BeiBei,$1,1/22/2015,China,Hangzhou,E-commerce & direct-to-consumer,"Banyan Capital, New Horizon Capital, IDG Capital Partners"
834,889,Lamabang,$1,3/6/2015,China,Shenzhen,E-commerce & direct-to-consumer,"5Y Capital, Matrix Partners China, K2VC"
835,890,JimuBox,$1,4/21/2015,China,Beijing,Fintech,"Matrix Partners China, Ventech China, Shunwei Capital Partners"
836,891,FXiaoKe,$1,7/2/2015,China,Beijing,Mobile & telecommunications,"IDG Capital, Northern Light Venture Capital, DCM Ventures"
837,892,Vox Media,$1,8/12/2015,United States,Washington,Internet software & services,"Accel Partners, Comcast Ventures, General Atlantic"
838,893,Mia.com,$1,9/8/2015,China,Beijing,E-commerce & direct-to-consumer,"Sequoia Capital China, ZhenFund, K2 Ventures"
839,894,58 Daojia,$1,10/12/2015,China,Beijing,Internet software & services,"KKR, Alibaba Group, Ping An Insurance"
840,895,Womai,$1,10/12/2015,China,Beijing,E-commerce & direct-to-consumer,"SAIF Partners China, Baidu, IDG Capital"
841,896,HuJiang,$1,10/29/2015,China,Shanghai,Edtech,"China Minsheng Investment, Baidu, Wanxin Media"
842,897,iTutorGroup,$1,11/18/2015,China,Shanghai,Edtech,"QiMing Venture Partners, Temasek Holdings, Silverlink Capital"
843,898,MindMaze,$1,1/28/2016,Switzerland,Lausanne,Health,Hinduja Group
844,899,iCarbonX,$1,4/12/2016,China,Shenzhen,Artificial intelligence,"Tencent, Vcanbio"
845,900,SMS Assist,$1,6/7/2016,United States,Chicago,Internet software & services,"Goldman Sachs, Insights Venture Partners, Pritzker Group Venture Capital"
846,901,Kendra Scott,$1,12/21/2016,United States,Austin,Consumer & retail,"Berkshire Partners, Norwest Venture Partners"
847,902,Mobvoi,$1,4/6/2017,China,Beijing,Consumer & retail,"Sequoia Capital China, SIG Asia Investments, ZhenFund"
848,903,Zhuan Zhuan,$1,4/18/2017,China,Beijing,E-commerce & direct-to-consumer,"58.com, Tencent Holdings"
849,904,Modernizing Medicine,$1,5/10/2017,United States,Boca Raton,Health,"Warburg Pincus, Summit Partners, Sands Capital"
850,905,Zhaogang,$1,6/29/2017,China,Shanghai,E-commerce & direct-to-consumer,"K2 Ventures, Matrix Partners China, IDG Capital"
851,906,DianRong,$1,8/2/2017,China,Shanghai,E-commerce & direct-to-consumer,"Standard Chartered, FinSight Ventures, Affirma Capital"
852,907,Cell C,$1,8/7/2017,South Africa,Midrand,Mobile & telecommunications,"Blue Label Telecoms, Net1 UEPS Technologies"
853,908,YH Global,$1,9/21/2017,China,Shenzhen,"Supply chain, logistics, & delivery","Co-Energy Finance, Grandland"
854,909,Revolution Precrafted,$1,10/23/2017,Philippines,Manila,Other,"K2 Global, 500 Startups"
855,910,WeLab,$1,11/8/2017,Hong Kong,,Fintech,"Sequoia Capital China, ING, Alibaba Entrepreneurs Fund"
856,911,Maimai,$1,11/15/2017,China,Beijing,Mobile & telecommunications,"Morningside Venture Capital, IDG Capital, DCM Ventures"
857,912,Dxy.cn,$1,4/10/2018,China,Hangzhou,Health,"Tencent Holdings, DCM Ventures"
858,913,Orbbec Technology,$1,5/21/2018,China,Shenzhen,Hardware,"R-Z Capital, Green Pine Capital Partners, SAIF Partners China"
859,914,HMD Global,$1,5/21/2018,Finland,Espoo,Mobile & telecommunications,Ginko Ventures
860,915,Huike Group,$1,5/24/2018,China,Beijing,Edtech,"Fosun RZ Capital, Oceanwide Holdings, Shenzhen Qianhe Capital Management Co."
861,916,China Cloud,$1,6/11/2018,China,Wuxi,Hardware,"V Star Capital, GF Xinde Investment Management Co., Haitong Leading Capital Management"
862,917,LinkDoc Technology,$1,7/5/2018,China,Beijing,Health,"China Investment Corporation, New Enterprise Associates"
863,918,MediaMath,$1,7/10/2018,United States,New York,Internet software & services,"Silicon Valley Bank, QED Investors, European Founders Fund"
864,919,Movile,$1,7/12/2018,Brazil,Sao Paulo,Mobile & telecommunications,"Innova Capital - FIP, 3G Capital Management, Prosus Ventures"
865,920,Kuaigou Dache,$1,7/13/2018,China,Tianjin,"Supply chain, logistics, & delivery","Sequoia Capital China, InnoVision Capital, Qianhai Fund of Funds"
866,921,Pat McGrath Labs,$1,7/16/2018,United States,New York,Consumer & retail,"One Luxury Group, Eurazeo"
867,922,Wacai,$1,7/18/2018,China,Hangzhou,Mobile & telecommunications,"Qiming Venture Partners, China Broadband Capital, CDH Investments"
868,923,FlashEx,$1,8/27/2018,China,Beijing,"Supply chain, logistics, & delivery","Prometheus Capital, Matrix Partners China, JD Capital Management"
869,924,Banma Network Technologies,$1,9/13/2018,China,Shanghai,Auto & transportation,"Yunfeng Capital, SDIC Innovation Investment Management, Shang Qi Capital"
870,925,Tresata,$1,10/10/2018,United States,Charlotte,Fintech,GCP Capital Partners
871,926,Momenta,$1,10/17/2018,China,Beijing,Artificial intelligence,"Sinovation Ventures, Tencent Holdings, Sequoia Capital China"
872,927,Hosjoy,$1,10/18/2018,China,Nanjing,E-commerce & direct-to-consumer,"U.S.-China Green Fund, Founder H Fund, Richland Equities"
873,928,Omio,$1,10/23/2018,Germany,Berlin,Travel,"Lakestar, Battery Ventures, New Enterprise Associates"
874,929,TERMINUS Technology,$1,10/25/2018,China,Beijing,Hardware,"China Everbright Limited, IDG Capital, iFLYTEK"
875,930,BitFury,$1,11/6/2018,Netherlands,Amsterdam,Hardware,"Georgian Co-Investment Fund, iTech Capital, Galaxy Digital"
876,931,iFood,$1,11/13/2018,Brazil,Osasco,"Supply chain, logistics, & delivery","Movile, Just Eat, Naspers"
877,932,Geek+,$1,11/21/2018,China,Beijing,Hardware,"Volcanics Ventures, Vertex Ventures China, Warburg Pincus"
878,933,REEF Technology,$1,12/10/2018,United States,Miami,"Supply chain, logistics, & delivery","Target Global, UBS Asset Management, Mubadala Capital"
879,934,Globality,$1,1/22/2019,United States,Menlo Park,Artificial intelligence,SoftBank Group
880,935,Ynsect,$1,2/21/2019,France,Evry,Other,"Astanor Ventures, Upfront Ventures, IDInvest Partners"
881,936,Intellifusion,$1,3/22/2019,China,Shenzhen,Artificial intelligence,"BOC International, TopoScend Capital, Hongxiu VC"
882,937,Poizon,$1,4/29/2019,China,Shanghai,Mobile & telecommunications,"DST Global, Sequoia Capital China, Gaorong Capital"
883,938,VTS,$1,5/7/2019,United States,New York,Internet software & services,"Trinity Ventures, Fifth Wall Ventures, OpenView Venture Partners"
884,939,SITECH DEV,$1,5/16/2019,China,Guiyang,Other,China Prosperity Capital
885,940,KnowBox,$1,5/30/2019,China,Beijing,Edtech,"TAL Education Group, Legend Star, Alibaba Group"
886,941,Yanolja,$1,6/10/2019,South Korea,Seoul,Travel,"SBI Investment Korea, Partners Investment, GIC"
887,942,Meero,$1,6/18/2019,France,Paris,Artificial intelligence,"Aglae Ventures, Global Founders Capital, Alven Capital"
888,943,SumUp,$1,7/16/2019,United Kingdom,London,Fintech,"American Express Ventures, Goldman Sachs, Bain Capital Credit"
889,944,Ibotta,$1,8/6/2019,United States,Denver,Fintech,"Koch Disruptive Technologies, Teamworthy Ventures, GGV Capital"
890,945,C2FO,$1,8/7/2019,United States,Leawood,Fintech,"Union Square Ventures, Summerhill Venture Partners, Mithril Capital Management"
891,946,Numbrs,$1,8/22/2019,Switzerland,Zurich,Fintech,"Investment Corporation of Dubai, Centralway"
892,947,EBANX,$1,10/16/2019,Brazil,Curitiba,Fintech,"FTV Capital, Endeavor"
893,948,KK Group,$3,10/23/2019,China,Dongguan,E-commerce & direct-to-consumer,"Matrix Partners China, Bright Venture Capita, Shenzhen Capital Group"
894,949,Alto Pharmacy,$1,1/30/2020,United States,San Francisco,Health,"Jackson Square Ventures, Greenoaks Capital Management, Softbank Group"
895,950,Hotmart,$1,3/17/2020,Netherlands,Amsterdam,E-commerce & direct-to-consumer,"Technology Crossover Ventures, Alkeon Capital Management, General Atlantic"
896,951,Emerging Markets Property Group,$1,4/28/2020,United Arab Emirates,Dubai,Other,"OLX Group, KCK Group, EXOR Seeds"
897,952,Quizlet,$1,5/13/2020,United States,San Francisco,Edtech,"Union Square Ventures, Altos Ventures, Costanoa Ventures"
898,953,Orca Bio,$1,6/17/2020,United States,Menlo Park,Health,"Lightspeed Venture Partners, Data Collective, 8VC"
899,954,Newlink Group,$1,7/10/2020,China,Beijing,E-commerce & direct-to-consumer,"JOY Capital, NIO Capital, Blueflame Capital"
900,955,Infobip,$1,7/30/2020,Croatia,Vodnjan,Mobile & telecommunications,One Equity Partners
901,956,Zwift,$1,9/16/2020,United States,Long Beach,E-commerce & direct-to-consumer,"Novator Partners, True, Causeway Media Partners"
902,957,Playco,$1,9/21/2020,Japan,Tokyo,Other,"Sozo Ventures, Caffeinated Capital, Sequoia Capital"
903,958,Socar,$1.07,10/16/2020,South Korea,Jeju-do,Auto & transportation,"Bain Capital, Altos Ventures, Songhyun Investment"
904,959,Gousto,$1.7,11/3/2020,United Kingdom,London,"Supply chain, logistics, & delivery","MMC Ventures, BGF Ventures, Unilever Ventures"
905,960,Boom Supersonic,$1,12/16/2020,United States,Englewood,Other,"WRVI Capital, Caffeinated Capital, Y Combinator"
906,961,Quantum Metric,$1,1/7/2021,United States,Colorado Springs,Data management & analytics,"Insight Partners, Bain Capital Ventures"
907,962,News Break,$1,1/7/2021,United States,Mountain View,Internet software & services,"IDG Capital, Francisco Partners, ZhenFund"
908,963,MadeiraMadeira,$1,1/7/2021,Brazil,Parana,E-commerce & direct-to-consumer,"Flybridge Capital Partners, SoftBank Group, Monashees+"
909,964,PPRO,$1,1/19/2021,United Kingdom,London,Fintech,"Wellington Management, Eurazeo, Citi Ventures"
910,965,Splashtop,$1,1/27/2021,United States,San Jose,Internet software & services,"Storm Ventures, DFJ DragonFund, New Enterprise Associates"
911,966,DriveNets,$1,1/27/2021,Israel,Ra'anana,Internet software & services,"Bessemer Venture Partners, Pitango Venture Capital, D1 Capital Partners"
912,967,Flash Express,$1,2/1/2021,Thailand,Bangkok,"Supply chain, logistics, & delivery","SCB 10X, Krungsri Finnovate, eWTP Capital"
913,968,Axiom Space,$1,2/16/2021,United States,Houston,Other,"C5 Capital, Hemisphere Ventures, The Venture Collective"
914,969,Locus Robotics,$1,2/17/2021,United States,Wilmington,Hardware,"Scale Venture Partners, Bond, Tiger Global Management"
915,970,Standard,$1,2/17/2021,United States,San Francisco,Artificial intelligence,"CRV, Y Combinator, Initialized Capital"
916,971,WeBull,$1,2/18/2021,China,Changsha,Fintech,"Bojiang Capital, Hongdao Capital, Mobai Capital"
917,972,Skydio,$1,2/25/2021,United States,Redwood City,"Supply chain, logistics, & delivery","Andreessen Horowitz, Andreessen Horowitz, Institutional Venture Partners, Accel"
918,973,Newsela,$1,2/25/2021,United States,New York,Internet software & services,"Owl Ventures, Technology Crossover Ventures, Tao Capital Partners"
919,974,Aqua Security,$1,3/10/2021,Israel,Ramat Gan,Cybersecurity,"TLV Partners, Lightspeed Venture Partners, M12"
920,975,PatSnap,$1,3/16/2021,Singapore,,Internet software & services,"Sequoia Capital China, Shunwei Capital Partners, Qualgro"
921,976,Evidation,$1,3/22/2021,United States,San Mateo,Health,"B Capital Group,, GE Ventures, McKesson Ventures"
922,977,Sidecar Health,$1,1/26/2021,United States,El Segundo,Fintech,"GreatPoint Ventures, Tiger Global Management, Menlo Ventures"
923,978,Feedzai,$1,3/24/2021,United States,San Mateo,Artificial intelligence,"Global Founders Capital, Shea Ventures, Greycroft"
924,979,Yunxuetang,$1,3/29/2021,China,Suzhou,Edtech,"Matrix Partners China, Sequoia Capital China, Hundreds Capital"
925,980,Cameo,$1,3/30/2021,United States,Chicago,Internet software & services,"Lightspeed Venture Partners, Kleiner Perkins Caufield & Byers, Origin Ventures"
926,981,Hyperchain,$1,4/11/2021,China,Hangzhou,Fintech,"Yinhong Equity Investment Fund, E Fund, Ideal International"
927,982,The Zebra,$1,4/12/2021,United States,Austin,E-commerce & direct-to-consumer,"Silverton Partners, Accel, Ballast Point Ventures"
928,983,Clearcover,$1,4/13/2021,United States,Chicago,Fintech,"American Family Ventures, Cox Enterprises, OMERS Ventures"
929,984,Groq,$1,4/14/2021,United States,Mountain View,Artificial intelligence,"TDK Ventures, Social Capital, D1 Capital Partners"
930,985,Fiture,$1,4/14/2021,China,Chengdu,Health,"Bertelsmann Asia Investments, Sequoia Capital China, NIO Capital"
931,986,Injective Protocol,$1,4/20/2021,United States,New York,Fintech,"Pantera Capital, Cadenza Ventures, BlockTower Capital"
932,987,Sift,$1,4/22/2021,United States,San Francisco,Artificial intelligence,"Union Square Ventures, Insight Partners, Spark Capital"
933,988,SaltPay,$1,4/9/2021,United Kingdom,London,Fintech,"Tiger Global Management, Hedosophia"
934,989,Capsule,$1,4/28/2021,United States,New York,Health,"Thrive Capital, Durable Capital Partners, G Squared"
935,990,MOLOCO,$1.5,4/29/2021,United States,Redwood City,Artificial intelligence,"Smilegate Investment, DSC Investments, KTB Ventures"
936,991,Mux,$1,4/30/2021,United States,San Francisco,Internet software & services,"Accel, Cobalt Capital, Andreessen Horowitz"
937,992,XForcePlus,$1,6/1/2021,China,Shanghai,Internet software & services,"Eastern Bell Capital, Danhua Capital, MSA Capital"
938,993,Firefly Aerospace,$1.1,5/4/2021,United States,Cedar Park,Other,"XBTO Ventures, Raven One Ventures, SK Ventures"
939,994,Shift Technology,$1,5/6/2021,France,Paris,Artificial intelligence,"Griffin Gaming Partners, Andreessen Horowitz, Battery Ventures"
940,995,TensTorrent,$1,5/5/2021,Canada,Toronto,Artificial intelligence,"Eclipse Ventures, Fidelity Investments, Moore Capital Management"
941,996,Zihaiguo,$1,5/6/2021,China,Chongqing,Consumer & retail,"Xingwang Investment Management, China Capital Investment Group, Matrix Partners China"
942,997,Forte Labs,$1.73,5/12/2021,United States,San Francisco,Fintech,"Iris Capital, Accel, Elaia Partners"
943,998,Axtria,$1,5/13/2021,United States,Berkeley Heights,Data management & analytics,"Helion Venture Partners, Bain Capital Tech Opportunities, Sequoia Capital India"
944,999,Amount,$1,5/17/2021,United States,Chicago,Fintech,"Invus Group, Hanaco Venture Capital, WestCap Group"
945,1000,Vise,$1,5/18/2021,United States,New York,Fintech,"Sequoia Capital, Founders Fund, Bling Capital"
946,1001,Printful,$1,5/24/2021,United States,Charlotte,Other,Bregal Sagemount
947,1002,Matrixport,$1.05,6/1/2021,Singapore,,Fintech,"Dragonfly Captial, Qiming Venture Partners, DST Global"
948,1003,Shippo,$1,6/2/2021,United States,San Francisco,"Supply chain, logistics, & delivery","Version One Ventures, Uncork Capital, Bessemer Venture Partners"
949,1004,Thirty Madison,$1,6/2/2021,United States,New York,Health,"Northzone Ventures, Maveron, Johnson & Johnson Innovation"
950,1005,LetsGetChecked,$1,6/7/2021,Ireland,Dublin,Health,"Optum Ventures, Qiming Venture Partners, Transformation Capital"
951,1006,EcoFlow,$1,6/10/2021,China,Shenzhen,Hardware,"Delian Capital, China International Capital Corporation, Sequoia Capital China"
952,1007,Carro,$1,6/14/2021,Singapore,,E-commerce & direct-to-consumer,"SingTel Innov8, Alpha JWC Ventures, Golden Gate Ventures"
953,1008,Tractable,$1,6/16/2021,United Kingdom,London,Artificial intelligence,"Insight Partners, Ignition Partners, Georgian Partners"
954,1009,Xiaoe Tech,$1,6/15/2021,China,Shenzhen,Internet software & services,"GGV Capital, Hillhouse Capital Management, IDG Capital"
955,1010,Bringg,$1,6/16/2021,Israel,Tel Aviv,"Supply chain, logistics, & delivery","Salesforce Ventures, next47, Pereg Ventures"
956,1011,Claroty,$1,6/17/2021,United States,New York,Cybersecurity,"Bessemer Venture Partners, MoreVC, Team8"
957,1012,JoyTunes,$1,6/21/2021,Israel,Tel Aviv,Edtech,"Genesis Partners, Aleph, Insight Partners"
958,1013,Aircall,$1,6/23/2021,United States,New York,Internet software & services,"Balderton Capital, Next World Capital, Draper Esprit"
959,1014,Worldcoin,$1,6/29/2021,United States,San Francisco,Fintech,"Day One Ventures, Coinbase Ventures, Andreessen Horowitz"
960,1015,SmartAsset,$1,6/24/2021,United States,New York,Fintech,"Javelin Venture Partners, TTV Capital, Peterson Ventures"
961,1016,Morning Consult,$1,6/8/2021,United States,Washington DC,Internet software & services,"Advance Venture Partners, Susquehanna Growth Equity, Lupa Systems"
962,1017,Visier,$1,6/29/2021,Canada,Vancouver,Internet software & services,"Foundation Capital, Summit Partners, Adams Street Partners"
963,1018,ShipBob,$1,6/29/2021,United States,Chicago,"Supply chain, logistics, & delivery","Hyde Park Venture Partners,	FundersClub. Bain Capital Ventures"
964,1019,bolttech,$1,7/1/2021,Singapore,,Fintech,"Mundi Ventures, Doqling Capital Partners, Activant Capital"
965,1020,MobileCoin,$1.06,7/7/2021,United States,San Francisco,Fintech,"General Catalyst, Future Ventures, AU21"
966,1021,Amperity,$1,7/13/2021,United States,Seattle,Artificial intelligence,"Madrona Venture Group, Tiger Global Management, Madera Technology Partners"
967,1022,Pantheon Systems,$1,7/13/2021,United States,San Francisco,Internet software & services,"Foundry Group, Scale Venture Partners, SoftBank Group"
968,1023,Xiaobing,$1,7/12/2021,China,Beijing,Fintech,"NetEase Capital, Northern Light Venture Capital, Microsoft"
969,1024,dMed Biopharmaceutical,$1,7/12/2021,China,Shanghai,Health,"Qiming Venture Partners, Vivo Capital, Sequoia Capital China"
970,1025,Carson Group,$1,7/14/2021,United States,Lincoln,Fintech,Bain Capital
971,1026,GO1,$1,7/19/2021,Australia,Brisbane,Internet software & services,"Y Combinator, M12, SEEK"
972,1027,Interos,$1,7/22/2021,United States,Arlington,Fintech,"Kleiner Perkins Caufield & Byers, NightDragon Security, Venrock"
973,1029,NIUM,$1,7/13/2021,Singapore,,Fintech,"Vertex Ventures SE Asia, Global Founders Capital, Visa Ventures"
974,1030,Human Interest,$1,8/4/2021,United States,San Francisco,Fintech,"Wing Venture Capital, Slow Ventures, Uncork Capital"
975,1031,Bluecore,$1,8/5/2021,United States,New York,Artificial intelligence,"FirstMark Capital, Georgian Partners, Norwest Venture Partners"
976,1032,Freshbooks,$1,8/10/2021,Canada,Toronto,Fintech,"Accomplice, Oak Investment Partners, Georgian Partners"
977,1033,Snorkel AI,$1,8/9/2021,United States,Palo Alto,Artificial intelligence,"Greylock Partners, Google Ventures, BlackRock"
978,1034,Gelato,$1,8/16/2021,Norway,Oslo,E-commerce & direct-to-consumer,"Greylock Partners, Google Ventures, BlackRock"
979,1035,Maven Clinic,$1,8/17/2021,United States,New York,Health,"Female Founders Fund, Oak HC/FT Partners, Sequoia Capital"
980,1036,Dunamu,$1,7/22/2021,South Korea,Seoul,Fintech,"Qualcomm Ventures, Woori Investment, Hanwha Investment & Securities"
981,1037,Shield AI,$1,8/24/2021,United States,San Diego,Artificial intelligence,"Andreessen Horowitz, Homebrew, Point72 Ventures"
982,1038,PicsArt,$1,8/26/2021,United States,San Francisco,Mobile & telecommunications,"Sequoia Capital, DCM Ventures, Insight Partners"
983,1039,1KMXC,$1,8/30/2021,China,Hangzhou,Hardware,"Goldman Sachs Asset Management, SDP Investment, Alibaba Group"
984,1040,Cider,$1,9/2/2021,Hong Kong,,E-commerce & direct-to-consumer,"Andreessen Horowitz, DST Global, IDG Capital"
985,1041,Berlin Brands Group,$1,9/1/2021,Germany,Berlin,E-commerce & direct-to-consumer,"Ardian, Bain Capital"
986,1042,Agile Robots,$1,9/9/2021,Germany,Munich,Hardware,"Hillhouse Capital Management, Sequoia Capital China, Linear Venture"
987,1043,GrubMarket,$1.2,9/14/2021,United States,San Francisco,E-commerce & direct-to-consumer,"GGV Capital, BlackRock, ACE & Company"
988,1044,Mammoth Biosciences,$1,9/9/2021,United States,Brisbane,Health,"NFX, Plum Alley, Mayfield"
989,1045,Orchard,$1,9/9/2021,United States,New York,Fintech,"Accomplice, Juxtapose, FirstMark Capital"
990,1046,Xendit,$1,9/14/2021,Indonesia,Jakarta,Fintech,"Accel, Y Combinator, Amasia"
991,1047,TrueLayer,$1,9/21/2021,United Kingdom,London,Fintech,"Anthemis, Connect Ventures, Northzone Ventures"
992,1048,Assembly,$1,9/21/2021,United States,Culver City,Internet software & services,"Advent International, PSG, Providence Equity Partners"
993,1049,PandaDoc,$1,9/22/2021,United States,San Francisco,Internet software & services,"Rembrandt Venture Partners, M12, Altos Ventures"
994,1050,Keenon Robotics,$1,9/15/2021,China,Shanghai,"Supply chain, logistics, & delivery","Yunqi Partners, SoftBank Group, iVision Ventures"
995,1051,HAYDON,$1,9/24/2021,China,Shanghai,Consumer & retail,"Tencent Holdings, Hillhouse Capital Management"
996,1052,Ninja Van,$1,9/27/2021,Singapore,,"Supply chain, logistics, & delivery","B Capital Group, Monk's Hill Ventures, Dynamic Parcel Distribution"
997,1054,TrialSpark,$1,9/30/2021,United States,New York,Health,"Sequoia Capital, Thrive Capital, Sound Ventures"
998,1055,Ajaib,$1,10/4/2021,Indonesia,Jakarta,Fintech,"Softbank Ventures Asia, Alpha JWC Ventures, Insignia Ventures Partners"
999,1057,Masterworks,$1,10/5/2021,United States,New York,Fintech,"Left Lane Capital, Galaxy Interactive, Tru Arrow Partners"
1000,1058,Chronosphere,$1,10/7/2021,United States,New York,Data management & analytics,"Greylock Partners, Lux Capital, General Atlantic"
1001,1059,Solo.io,$1,10/7/2021,United States,Cambridge,Internet software & services,"True Ventures, Altimeter Capital, Redpoint Ventures"
1002,1060,Savage X Fenty,$1,2/10/2021,United States,El Segundo,E-commerce & direct-to-consumer,"Speedinvest, Valar Ventures, Uniqa Ventures"
1003,1061,Swile,$1,10/11/2021,France,Montpellier,Fintech,"Index Ventures, IDInvest Partners, Daphni"
1004,1063,Weights & Biases,$1,10/13/2021,United States,San Francisco,Internet software & services,"Coatue Management, Insight Partners, Trinity Ventures"
1005,1064,Zopa,$1,10/19/2021,United Kingdom,London,Fintech,"IAG Capital Partners, Augmentum Fintech, Northzone Ventures"
1006,1065,Dental Monitoring,$1,10/21/2021,France,Paris,Health,"Vitruvian Partners, Merieux Equity Partners, Straumann"
1007,1066,CargoX,$1,10/21/2021,Brazil,Sao Paulo,"Supply chain, logistics, & delivery","Valor Capital Group, Lightrock, Softbank Group"
1008,1067,Fabric,$1,10/26/2021,United States,New York,"Supply chain, logistics, & delivery","Innovation Endeavors, Aleph, Temasek"
1009,1068,Augury,$1,10/26/2021,United States,New York,Artificial intelligence,"Lerer Hippeau, Munich Re Ventures, Eclipse Ventures"
1010,1069,Moka,$1,11/2/2021,China,Beijing,Internet software & services,"GGV Capital, GSR Ventures, FreesFund"
1011,1070,Tezign,$1,11/2/2021,China,Shanghai,Internet software & services,"Sequoia Capital China, Linear Venture, Hearst Ventures"
1012,1071,Vagaro,$1,11/3/2021,United States,Dublin,Internet software & services,FTV Capital
1013,1072,Drata,$1,11/8/2021,United States,San Diego,Cybersecurity,"Cowboy Ventures, Leaders Fund, GGV Capital"
1014,1073,Razor,$1,11/8/2021,Germany,Berlin,Consumer & retail,"Global Founders Capital, 468 Capital, Redalpine Venture Partners"
1015,1074,OpenWeb,$1,11/9/2021,United States,New York,Internet software & services,"Insight Partners, AltaIR Capital, Norma Investments"
1016,1075,Contrast Security,$1,11/9/2021,United States,Los Altos,Cybersecurity,"Acero Capital, General Catalyst, M12"
1017,1076,Wrapbook,$1,11/10/2021,United States,New York,Fintech,"Equal Ventures, Uncork Capital, Andreessen Horowitz"
1018,1077,Gaussian Robotics,$1.1,11/10/2021,China,Shanghai,Hardware,"BlueRun Ventures, Grand Flight Investment, Meituan Dianping"
1019,1079,Heyday,$1,11/16/2021,United States,Chicago,E-commerce & direct-to-consumer,"Khosla Ventures,General Catalyst, Victory Park Capital"
1020,1080,PLACE,$1,11/17/2021,United States,Bellingham,Internet software & services,"Goldman Sachs Asset Management, 3L"
1021,1081,Stytch,$1,11/18/2021,United States,San Francisco,Cybersecurity,"Index Ventures, Benchmark, Thrive Capital"
1022,1082,Owkin,$1,11/18/2021,United States,New York,Artificial Intelligence,"Google Ventures, Cathay Innovation, NJF Capital"
1023,1083,Expel,$1,11/18/2021,United States,Herndon,Cybersecurity,"Paladin Capital Group, Greycroft, Scale Venture Partners"
1024,1085,Lessen,$1,11/30/2021,United States,Scottsdale,Internet software & services,"Khosla Ventures, General Catalyst, Navitas Capital"
1025,1086,Clara,$1,12/6/2021,Mexico,Mexico City,Fintech,"DST Global, General Catalyst, Monashees+"
