,Unnamed: 0,Company,Valuation ($B),Date Joined,Country,City,Industry,Select Investors
0,0,Bytedance,$140,4/7/2017,China,Beijing,Artificial intelligence,"Sequoia Capital China, SIG Asia Investments, Sina Weibo, Softbank Group"
1,1,SpaceX,$125,12/1/2012,United States,Hawthorne,Other,"Founders Fund, Draper Fisher Jurvetson, Rothenberg Ventures"
2,2,SHEIN,$100,7/3/2018,China,Shenzhen,E-commerce & direct-to-consumer,"Tiger Global Management, Sequoia Capital China, Shunwei Capital Partners"
3,3,Stripe,$95,1/23/2014,United States,San Francisco,Fintech,"Khosla Ventures, LowercaseCapital, capitalG"
4,4,Klarna,$45.6,12/12/2011,Sweden,Stockholm,Fintech,"Institutional Venture Partners, Sequoia Capital, General Atlantic"
5,5,Canva,$40,1/8/2018,Australia,Surry Hills,Internet software & services,"Sequoia Capital China, Blackbird Ventures, Matrix Partners"
6,6,Checkout.com,$40,5/2/2019,United Kingdom,London,Fintech,"Tiger Global Management, Insight Partners, DST Global"
7,7,Instacart,$39,12/30/2014,United States,San Francisco,"Supply chain, logistics, & delivery","Khosla Ventures, Kleiner Perkins Caufield & Byers, Collaborative Fund"
8,8,Databricks,$38,2/5/2019,United States,San Francisco,Data management & analytics,"Andreessen Horowitz, New Enterprise Associates, Battery Ventures"
9,9,Revolut,$33,4/26/2018,United Kingdom,London,Fintech,"index Ventures, DST Global, Ribbit Capital"
10,10,Epic Games,$31.5,10/26/2018,United States,Cary,Other,"Tencent Holdings, KKR, Smash Ventures"
11,11,FTX,$32,7/20/2021,Bahamas,,Fintech,"Sequoia Capital, Thoma Bravo, Softbank"
12,12,Fanatics,$27,6/6/2012,United States,Jacksonville,E-commerce & direct-to-consumer,"SoftBank Group, Andreessen Horowitz, Temasek Holdings"
13,13,Chime,$25,3/5/2019,United States,San Francisco,Fintech,"Forerunner Ventures, Crosslink Capital, Homebrew"
14,15,Xiaohongshu,$20,3/31/2016,China,Shanghai,E-commerce & direct-to-consumer,"GGV Capital, ZhenFund, Tencent"
15,16,J&T Express,$20,4/7/2021,Indonesia,Jakarta,"Supply chain, logistics, & delivery","Hillhouse Capital Management, Boyu Capital, Sequoia Capital China"
16,17,Miro,$17.5,1/5/2022,United States,San Francisco,Internet software & services,"Accel, AltaIR Capital, Technology Crossover Ventures"
17,18,Yuanfudao,$15.5,5/31/2017,China,Beijing,Edtech,"Tencent Holdings, Warbug Pincus, IDG Capital"
18,19,DJI Innovations,$15,1/23/2015,China,Shenzhen,Hardware,"Accel Partners, Sequoia Capital"
19,20,Discord,$15,4/20/2018,United States,San Francisco,Internet software & services,"Benchmark, Greylock Partners, Tencent Holdings"
20,21,goPuff,$15,10/8/2020,United States,Philadelphia,E-commerce & direct-to-consumer,"Accel, Softbank Group, Anthos Capital"
21,22,Yuanqi Senlin,$15,3/1/2020,China,Beijing,Consumer & retail,"Sequoia Capital China, Longfor Capitalm, Gaorong Capital"
22,23,Ripple,$15,12/20/2019,United States,San Francisco,Fintech,"IDG Capital, Venture51, Lightspeed Venture Partners"
23,24,Blockchain.com,$14,2/17/2021,United Kingdom,London,Fintech,"Lightspeed Venture Partners, Google Ventures, Lakestar"
24,25,Plaid,$13.5,12/11/2018,United States,San Francisco,Fintech,"New Enterprise Associates, Spar Capital, Index Ventures"
25,26,OpenSea,$13.3,7/20/2021,United States,New York,E-commerce & direct-to-consumer,"Andreessen Horowitz, Thirty Five Ventures, Sound Ventures"
26,27,Grammarly,$13,10/10/2019,United States,San Francisco,Internet software & services,"General Catalyst, Institutional Venture Partners, Breyer Capital"
27,28,Devoted Health,$12.6,10/16/2018,United States,Waltham,Health,"Andreessen Horowitz, F-Prime Capital, Venrock"
28,29,Faire,$12.59,10/30/2019,United States,San Francisco,Artificial intelligence,"Khosla Ventures, Forerunner Ventures, Sequoia Capital"
29,30,Brex,$12.3,10/5/2018,United States,San Francisco,Fintech,"DST Global, Ribbit Capital, Greenoaks Capital Management"
30,31,JUUL Labs,$12,12/20/2017,United States,San Francisco,Consumer & retail,Tiger Global Management
31,32,Bitmain Technologies,$12,7/6/2018,China,Beijing,Hardware,"Coatue Management, Sequoia Capital China, IDG Capital"
32,33,Biosplice Therapeutics,$12,8/6/2018,United States,San Diego,Health,"Vickers Venture Partners, IKEA GreenTech"
33,34,GoodLeap,$12,10/13/2021,United States,Roseville,Internet software & services,"New Enterprise Associates, BDT Capital Partners, Davidson Kempner Capital Management"
34,35,Xingsheng Selected,$12,7/22/2020,China,Changsha,E-commerce & direct-to-consumer,"KKR, Tencent Holdings, Sequoia Capital China"
35,36,Deel,$12,4/21/2021,United States,San Francisco,Fintech,"Andreessen Horowitz, Spark Capital, Y Combinator"
36,37,Getir,$11.8,3/26/2021,Turkey,Istanbul,E-commerce & direct-to-consumer,"Tiger Global Management, Sequoia Capital, Revo Capital"
37,38,Airtable,$11.7,11/15/2018,United States,San Francisco,Internet software & services,"Caffeinated Capital, CRV, Founder Collective"
38,39,ZongMu Technology,$11.4,6/3/2021,China,Shanghai,Auto & transportation,"LTW Capital, Legend Capital, Qualcomm Ventures"
39,40,Rippling,$11.25,8/4/2020,United States,San Francisco,Internet software & services,"Initialized Capital, Y Combinator, Kleiner Perkins Caufield & Byers"
40,41,Global Switch,$11.1,12/22/2016,United Kingdom,London,Hardware,"Aviation Industry Corporation of China, Essence Financial, Jiangsu Sha Steel Group"
41,42,Celonis,$11,6/26/2018,Germany,Munich,Data management & analytics,"Accel, 83North"
42,43,Bolt,$11,10/8/2021,United States,San Francisco,Fintech,"Activant Capital, Tribe Capital, General Atlantic"
43,44,Alchemy,$10.2,10/28/2021,United States,San Francisco,Fintech,"DFJ Growth Fund, Coatue Management, Addition"
44,45,Weilong,$10.88,5/8/2021,China,Luohe,Consumer & retail,"Tencent Holdings, Hillhouse Capital Management, Yunfeng Capital"
45,47,Lalamove,$10,2/21/2019,Hong Kong,Cheung Sha Wan,"Supply chain, logistics, & delivery","MindWorks Ventures, Shunwei Capital Partners, Xiang He Capital"
46,48,Figma,$10,4/30/2020,United States,San Francisco,Internet software & services,"Index Ventures, Greylock Partners, Kleiner Perkins Caufield & Byers"
47,49,Gusto,$10,12/18/2015,United States,San Francisco,Fintech,"General Catalyst Partners, Google Ventures, Kleiner Perkins Caufield & Byers"
48,50,Chehaoduo,$10,3/12/2016,China,Beijing,E-commerce & direct-to-consumer,"Sequoia Capital China, GX Capital"
49,51,reddit,$10,7/31/2017,United States,San Francisco,Internet software & services,"Y Combinator, Sequoia Capital, Coatue Management"
50,52,Talkdesk,$10,10/3/2018,United States,San Francisco,Internet software & services,"DJF, Salesforce Ventures, Storm Ventures"
51,53,Notion Labs,$10,4/1/2020,United States,San Francisco,Internet software & services,"Index Ventures, Draft Ventures, Felicis Ventures"
52,54,Thrasio,$10,7/15/2020,United States,Walpole,Other,"Upper90, RiverPark Ventures, Advent International"
53,55,Digital Currency Group,$10,11/1/2021,United States,New York,Fintech,"Ribbit Capital, capitalG, Softbank Group"
54,56,KuCoin,$10,5/10/2022,Seychelles,Victoria,Fintech,"IDG Capital, Matrix Partners China, Jump Crypto"
55,57,OutSystems,$9.5,6/5/2018,United States,Boston,Internet software & services,"KKR, ES Ventures, North Bridge Growth Equity"
56,58,ServiceTitan,$9.5,11/14/2018,United States,Glendale,Internet software & services,"Bessemer Venture Partners, ICONIQ Capital, Battery Ventures"
57,59,HEYTEA,$9.28,7/1/2019,China,Shenzhen,Other,"Sequoia Capital China, Tencent Investment, BA Capital"
58,60,N26,$9.23,1/10/2019,Germany,Berlin,Fintech,"Redalpine Venture Partners, Earlybird Venture Capital, Valar Ventures"
59,61,Klaviyo,$9.2,11/17/2020,United States,Boston,Internet software & services,"Summit Partners, Accel, Astral Capital"
60,62,Northvolt,$9.08,6/12/2019,Sweden,Stockholm,Other,"Vattenfall, Volkswagen Group, Goldman Sachs"
61,63,Tanium,$9,3/31/2015,United States,Kirkland,Cybersecurity,"Andreessen Horowitz, Nor-Cal Invest, TPG Growth"
62,64,Niantic,$9,11/24/2017,United States,San Francisco,Mobile & telecommunications,"Nintendo, Google, Pokemon Company International, Spark Capital"
63,66,Rapyd,$8.75,12/3/2019,United Kingdom,London,Fintech,"Target Global, General Catalyst, Durable Capital Partners"
64,67,Kavak,$8.7,10/1/2020,Mexico,Lerma de Villada,E-commerce & direct-to-consumer,"DST Global, SoftBank Group, Mountain Nazca"
65,68,Snyk,$8.6,1/21/2020,United States,Boston,Cybersecurity,"BOLDstart Ventures, Google Ventures, Accel"
66,69,Nuro,$8.6,2/11/2019,United States,Mountain View,Auto & transportation,"SoftBank Group, Greylock Partners, Gaorong Capital"
67,70,Chainalysis,$8.6,11/23/2020,United States,New York,Fintech,"Addition, Benhcmark, Accel"
68,71,Pony.ai,$8.5,7/11/2018,United States,Fremont,Artificial intelligence,"Sequoia Capital China, IDG Capital, DCM Ventures"
69,72,Bolt,$8.4,5/29/2018,Estonia,Tallinn,Auto & transportation,"Didi Chuxing, Diamler, TMT Investments"
70,73,Lacework,$8.3,1/7/2021,United States,San Jose,Cybersecurity,"Sutter Hill Ventures, Liberty Global Ventures, Coatue Management"
71,74,Tipalti,$8.3,10/6/2020,United States,San Mateo,Fintech,"01 Advisors, Zeev Ventures, Group 11"
72,75,Tempus,$8.1,3/21/2018,United States,Chicago,Health,"New Enterprise Associates, T. Rowe Associates, Lightbank"
73,76,Ramp,$8.1,3/29/2021,United States,New York,Fintech,"D1 Capital Partners, Stripe, Coatue Management"
74,78,Fireblocks,$8,7/27/2021,United States,New York,Fintech,"Tenaya Capital, Coatue Management, Stripes Group"
75,79,Flexport,$8,4/30/2018,United States,San Francisco,"Supply chain, logistics, & delivery","Bloomberg Beta, Founders Fund, First Round Capital"
76,80,Caris Life Sciences,$7.83,5/12/2021,United States,Irving,Health,"Sixth Street Partners, OrbiMed Advisors, Highland Capital Management"
77,81,Dapper Labs,$7.6,3/30/2021,Canada,Vancouver,Fintech,"Union Square Ventures, Venrock, Andreessen Horowitz"
78,82,Hopin,$7.75,11/10/2020,United Kingdom,London,Internet software & services,"Accel, Northzone Ventures, Institutional Venture Partners"
79,83,Netskope,$7.5,11/13/2018,United States,Santa Clara,Cybersecurity,"Lightspeed Venture Partners, Social Capital, Accel"
80,85,Automattic,$7.5,5/27/2013,United States,San Francisco,Internet software & services,"Insight Venture Partners, Lowercase Capital, Polaris Partners"
81,86,Toss,$7.4,12/9/2018,South Korea,Seoul,Fintech,"Bessemer Venture Partners, Qualcomm Ventures, Kleiner Perkins Caufield & Byers"
82,87,Carta,$7.4,5/6/2019,United States,San Francisco,Fintech,"Menlo Ventures, Spark Capital, Union Square Ventures"
83,88,Scale AI,$7.3,8/5/2019,United States,San Francisco,Artificial intelligence,"Accel, Y Combinator, Index Ventures"
84,89,Argo AI,$7.25,7/12/2019,United States,Pittsburgh,Artificial intelligence,"Volkswagen Group, Ford Autonomous Vehicles"
85,90,Gong,$7.25,8/12/2020,United States,Palo Alto,Artificial intelligence,"Norwest Venture Partners, Next World Capital, Wing Venture Capital"
86,91,TripActions,$7.25,11/8/2018,United States,Palo Alto,Travel,"Andreessen Horowitz, Lightspeed Venture Partners, Zeev Ventures"
87,92,Gemini,$7.1,11/19/2021,United States,New York,Fintech,"Morgan Creek Digital, Marcy Venture Partners, 10T Fund"
88,93,We Doctor,$7,9/22/2015,China,Hangzhou,Health,"Tencent, Morningside Group"
89,94,Ro,$7,7/27/2020,United States,New York,Health,"Initialized Capital, General Catalyst, SignalFire"
90,95,ConsenSys,$7,11/17/2021,United States,New York,Fintech,"Third Point, Electric Capital, Coinbase Ventures"
91,96,Automation Anywhere,$6.8,7/2/2018,United States,San Jose,Artificial intelligence,"General Atlantic, Goldman Sachs, New Enterprise Associates"
92,97,1Password,$6.8,7/8/2021,Canada,Toronto,Cybersecurity,"Slack Fund, Accel, Skip Capital"
93,98,Ziroom,$6.6,1/17/2018,China,Beijing,E-commerce & direct-to-consumer,"Sequoia Capital China, Warburg Pincus, General Catalyst"
94,99,SVOLT,$6.51,6/8/2020,China,Changzhou,Auto & transportation,"IDG Capital, Bank Of China Group Investment,, SDIC CMC Investment Management"
95,101,Mollie,$6.5,9/8/2020,Netherlands,Amsterdam,Fintech,Technology Crossover Ventures
96,103,Doctolib,$6.4,3/19/2019,France,Paris,Health,"BPI France, Kerala Ventures, Accel"
97,104,DataRobot,$6.3,7/29/2019,United States,Boston,Artificial intelligence,"New Enterprise Associates, Accomplice, IA Ventures"
98,105,Personio,$6.3,1/19/2021,Germany,Munich,Internet software & services,"Global Founders Capital, Nortzone Ventures, Picus Capital"
99,106,Upgrade,$6.28,2/12/2018,United States,San Francisco,Fintech,"Union Square Ventures, Ribbit Capital, VY Capital"
100,107,Hinge Health,$6.2,1/6/2021,United States,San Francisco,Health,"Atomico, Insight Partners, Coatue Management"
101,108,Black Unicorn Factory,$6.1,5/20/2021,United States,Los Angeles,Other,Barter Ventures
102,109,Benchling,$6.1,4/14/2021,United States,San Francisco,Internet software & services,"Thrive Capital, Benchmark, MenloVentures"
103,110,Royole Corporation,$6,8/18/2015,China,Shenzhen,Hardware,"Warmsun Holding, IDG Capital Partners"
104,111,Better.com,$6,11/10/2020,United States,New York,Fintech,"Pine Brook, American Express Ventures, Kleiner Perkins Caufield & Byers"
105,112,Wiz,$6,3/17/2021,Israel,Tel Aviv,Cybersecurity,"Insight Partners, Sequoia Capital, Index Ventures"
106,113,iCapital Network,$6,7/27/2021,United States,New York,Fintech,"BlackRock, Blackstone, UBS"
107,114,6Sense,$5.2,3/30/2021,United States,San Francisco,Artificial intelligence,"Venrock, Battery Ventures, Insight Partners"
108,115,Attentive,$5.99,9/23/2020,United States,Hoboken,Mobile & telecommunications,"NextView Ventures, Eniac Ventures, Sequoia Capital"
109,116,Easyhome,$5.78,2/12/2018,China,Beijing,Consumer & retail,"Alibaba Group, Boyu Capital, Borui Capital"
110,117,Lianjia,$5.77,4/7/2016,China,Beijing,E-commerce & direct-to-consumer,"Tencent, Baidu, Huasheng Capital"
111,118,Vice Media,$5.7,4/2/2011,United States,Brooklyn,Internet software & services,"Technology Crossover Ventures, A&E Television Networks"
112,119,Cityblock Health,$5.7,12/10/2020,United States,Brooklyn,Health,"Thrive Capital, Maverick Ventures, Redpoint Ventures"
113,120,Workato,$5.7,1/12/2021,United States,Mountain View,Internet software & services,"Battery Ventures, Storm Ventures, Redpoint Ventures"
114,121,Back Market,$5.7,5/18/2021,France,Paris,E-commerce & direct-to-consumer,"Aglae Ventures, Eurazeo, Daphni"
115,122,RELEX,$5.7,2/17/2022,Finland,Helsinki,"Supply chain, logistics, & delivery","Blackstone, Technology Crossover Ventures, Summit Partners"
116,123,The Boring Company,$5.7,4/20/2022,United States,Pflugerville,Other,"VY Capital, 8VC, Craft Ventures"
117,124,Postman,$5.6,6/11/2020,United States,San Francisco,Internet software & services,"Nexus Venture Partners, CRV, Insight Partners"
118,125,FiveTran,$5.6,6/30/2020,United States,Oakland,Data management & analytics,"Matrix Partners, Andreessen Horowitz, General Catalyst"
119,126,Trade Republic,$5.36,5/20/2021,Germany,Berlin,Fintech,"Founders Fund. Accel, Creandum"
120,127,Rappi,$5.25,8/31/2018,Colombia,Bogota,"Supply chain, logistics, & delivery","DST Global, Andreessen Horowitz, Sequoia Capital, Redpoint e.ventures"
121,128,Collibra,$5.25,1/29/2019,Belgium,Brussels,Data management & analytics,"Index Ventures, Battery Ventures, ICONIQ Capital"
122,129,OneTrust,$5.1,7/11/2019,United States,Atlanta,Internet software & services,Insight Partners
123,130,QuintoAndar,$5.1,9/9/2019,Brazil,Campinas,E-commerce & direct-to-consumer,"Kaszek Ventures, General Atlantic, SoftBank Group"
124,131,C6 Bank,$5.05,12/2/2020,Brazil,Sao Paulo,Fintech,Credit Suisse
125,132,United Imaging Healthcare,$5,9/15/2017,China,Shanghai,Health,"China Life Insurance, China Development Bank Capital, CITIC Securities International"
126,133,Hello TransTech,$5,6/1/2018,China,Shanghai,Auto & transportation,"Ant Financial Services Group, GGV Capital"
127,134,Airwallex,$5.5,3/25/2019,Australia,Melbourne,Fintech,"DST Global, Sequoia Capital China, Tencent Holdings"
128,135,Mambu,$5.5,1/6/2021,Netherlands,Amsterdam,Fintech,"Runa Capital, Acton Capital Partners, Point Nine Capital"
129,136,Horizon Robotics,$5,2/27/2019,China,Beijing,Artificial intelligence,"Hillhouse Capital Management, Linear Venture, Morningside Venture Capital"
130,137,WM Motor,$5,3/8/2019,China,Shanghai,Auto & transportation,"Baidu Capital, Linear Venture, Tencent"
131,138,Howden Group Holdings,$5,9/29/2020,United Kingdom,London,Other,"General Atlantic, 3i Group, Huagai Capital"
132,139,SambaNova Systems,$5,4/13/2021,United States,Palo Alto,Data management & analytics,"Walden International, Google Ventures, Intel Capital"
133,140,ZEPZ,$5,8/23/2021,United Kingdom,London,Fintech,"Accel, Technology Crossover Ventures, LeapFrog Investments"
134,141,OakNorth Bank,$5,10/12/2017,United Kingdom,London,Fintech,"Clermont Group, Coltrane Asset Management, Toscafund Asset Management"
135,142,Moon Active,$5,1/26/2020,Israel,Tel Aviv,Mobile & telecommunications,"Insight Partners, Andalusian Capital Partners"
136,144,Cockroach Labs,$5,1/12/2021,United States,New York,Data management & analytics,"Google Ventures, Benchmark, FirstMark Capital"
137,146,Qonto,$5,1/11/2022,France,Paris,Fintech,"Alven Capital, Valar Ventures, Tencent Holdings"
138,148,Icertis,$5,7/17/2019,United States,Bellevue,Artificial intelligence,"Eight Roads Ventures, Greycroft, Ignition Partners"
139,149,Hopper,$5,3/24/2021,Canada,Montreal,Travel,"Capital One Growth Ventures, Citi Ventures, OMERS Ventures"
140,153,Cerebral,$4.8,6/10/2021,United States,San Francisco,Health,"Oak HC/FT Partners, Artis Ventures, WestCap Group"
141,154,Creditas,$4.8,12/18/2020,Brazil,Sao Paulo,Fintech,"Kaszek Ventures, Amadeus Capital Partners, Quona Capital"
142,155,Reify Health,$4.8,8/10/2021,United States,Boston,Health,"Sierra Ventures, Battery Ventures, Asset Management Ventures"
143,156,Chipone,$4.73,12/16/2021,China,Beijing,Hardware,"China Grand Prosperity Investment, Silk Road Huacheng, Oriza Equity Investment"
144,157,BetterUp,$4.7,2/25/2021,United States,San Francisco,Internet software & services,"Threshold Ventures, Lightspeed Venture Partners, Crosslink Capital"
145,158,Pleo,$4.7,7/6/2021,Denmark,Copenhagen,Fintech,"Creandum, Founders, Kinnevik"
146,159,SonarSource,$4.7,4/26/2022,Switzerland,Geneva,Internet software & services,"Advent International,General Catalyst,Insight Partners"
147,160,Anduril,$4.6,9/11/2019,United States,Irvine,Artificial intelligence,"Andreessen Horowitz, Founders Fund, Revolution Ventures"
148,161,Lyra Health,$5.85,8/25/2020,United States,Burlingame,Health,"Greylock Partners, Venrock, Providence Ventures"
149,162,Dataiku,$4.6,12/4/2019,United States,New York,Internet software & services,"Alven Capital, FirstMark Capital, capitalG"
150,163,Checkr,$4.6,9/19/2019,United States,San Francisco,Internet software & services,"Y Combinator, Accel, T. Rowe Price"
151,164,Color,$4.6,1/4/2021,United States,Burlingame,Health,"General Catalyst, Viking Global Investors, T. Rowe Price"
152,165,Meizu Technology,$4.58,7/23/2014,China,Zhuhai,Hardware,"Telling Telecommunication Holding Co., Alibaba Group"
153,166,Lendable,$4.58,3/31/2021,United Kingdom,London,Fintech,"Ontario Teachers' Pension Plan, Goldman Sachs"
154,167,Vinted,$4.53,11/27/2019,Lithuania,Vilnius,E-commerce & direct-to-consumer,"Accel, Insight Partners, Burda Principal Investments"
155,168,VIPKid,$4.5,8/4/2016,China,Beijing,Edtech,"Sequoia Capital China, Tencent Holdings, Sinovation Ventures"
156,169,Socure,$4.5,3/16/2021,United States,New York,Cybersecurity,"Two Sigma Ventures, Flint Capital, Commerce Ventures"
157,170,Monzo,$4.5,10/31/2018,United Kingdom,London,Fintech,"Passion Capital, Thrive Capital, Orange Digital Ventures"
158,171,UBTECH Robotics,$4.58,7/25/2016,China,Shenzhen,Hardware,"CDH Investments, Goldstone Investments, Qiming Venture Partners"
159,172,Outreach,$4.4,4/16/2019,United States,Seattle,Internet software & services,"Mayfield Fund, M12, Trinity Ventures"
160,173,WeRide,$4.4,12/23/2020,China,Guangzhou,Auto & transportation,"Atop Capital, IDInvest Partners, Qiming Venture Partners"
161,174,Guild Education,$4.4,11/13/2019,United States,Denver,Internet software & services,"General Atlantic, Blackstone, ICONIQ Growth"
162,175,Arctic Wolf Networks,$4.3,10/22/2020,United States,Eden Prairie,Cybersecurity,"Lightspeed Venture Partners, Redpoint Ventures, Viking Global Investors"
163,176,Sorare,$4.3,9/21/2021,France,Paris,E-commerce & direct-to-consumer,"Benchmark, Accel, SoftBank Group"
164,177,Relativity Space,$4.2,11/23/2020,United States,Inglewood,Other,"Playground Global, Bond, Tribe Capital"
165,178,Miaoshou Doctor,$4.25,6/27/2019,China,Beijing,E-commerce & direct-to-consumer,"Sequoia Capital China, Qiming Venture Partners, Tencent Holdings"
166,179,ThoughtSpot,$4.2,5/8/2018,United States,Sunnyvale,Internet software & services,"Lightspeed Venture Partners, Khosla Ventures, Geodesic Capital"
167,180,Globalization Partners,$4.2,1/24/2022,United States,Boston,Internet software & services,"Vista Equity Partners, Wincove, TDR Capital"
168,181,dbt Labs,$4.2,6/30/2021,United States,Philadelphia,Data management & analytics,"Andreessen Horowitz, Amplify Partners, Sequoia Capital"
169,182,SSENSE,$4.15,6/8/2021,Canada,Montreal,E-commerce & direct-to-consumer,Sequoia Capital
170,183,Dataminr,$4.1,6/4/2018,United States,New York,Artificial intelligence,"Venrock, Institutional Venture Partners, Goldman Sachs"
171,184,BitPanda,$4.11,3/16/2021,Austria,Vienna,Fintech,"Speedinvest, Valar Ventures, Uniqa Ventures"
172,185,Weee!,$4.1,3/16/2021,United States,Fremont,"Supply chain, logistics, & delivery","Goodwater Capital, iFly, XVC Venture Capital"
173,186,Houzz,$4,9/30/2014,United States,Palo Alto,E-commerce & direct-to-consumer,"New Enterprise Associates, Sequoia Capital, Comcast Ventures"
174,188,Yello Mobile,$4,11/11/2014,South Korea,Seoul,Mobile & telecommunications,Formation 8
175,189,MEGVII,$4,10/31/2017,China,Beijing,Artificial intelligence,"Ant Financial Services Group, Russia-China Investment Fund, Foxconn Technology Company"
176,190,Greensill,$4,7/16/2018,United Kingdom,London,Fintech,"SoftBank Group, General Atlantic"
177,191,Impossible Foods,$4,5/13/2019,United States,Redwood City,Consumer & retail,"Khosla Ventures, Horizons Ventures, Temasek Holdings"
178,192,Radiology Partners,$4,2/26/2018,United States,El Segundo,Health,"New Enterprise Associates, Starr Investment Holdings"
179,193,Next Insurance,$4,10/7/2019,United States,Palo Alto,Fintech,"Zeev Ventures, Ribbit Capital, TLV Partners"
180,194,Patreon,$4,9/2/2020,United States,San Francisco,Internet software & services,"Index Ventures, Thrive Capital, CRV"
181,195,PointClickCare,$4,1/7/2021,Canada,Mississauga,Internet software & services,"Dragoneer Investment Group, Hellman & Friedman, JMI Equity"
182,196,Zapier,$4,1/14/2021,United States,Sunnyvale,Internet software & services,"Sequoia Capital, Bessemer Venture Partners, Threshold Ventures"
183,197,Clubhouse,$4,1/24/2021,United States,San Francisco,Mobile & telecommunications,"Andreessen Horowitz, TQ Ventures"
184,198,BrowserStack,$4,6/16/2021,Ireland,Dublin,Internet software & services,"Accel, Insight Partners, Bond Capital"
185,199,Olive,$4,12/1/2020,United States,Columbus,Internet software & services,"Drive Capital, General Catalyst, Ascension Ventures"
186,200,Rubrik,$4,4/28/2017,United States,Palo Alto,Data management & analytics,"Greylock Partners, Lightspeed Venture Partners, Khosla Ventures"
187,201,Melio,$4,1/25/2021,United States,New York,Fintech,"Accel, Aleph, American Express Ventures"
188,202,Vuori,$4,10/13/2021,United States,Carlsbad,E-commerce & direct-to-consumer,"SoftBank Group, Norwest Venture Partners"
189,203,ClickUp,$4,12/15/2020,United States,San Diego,Internet software & services,"Georgian Partners, Craft Ventures"
190,204,Cerebras Systems,$4,11/14/2018,United States,Los Altos,Hardware,"Benchmark, Foundation Capital, Sequoia Capital"
191,205,Farmers Business Network,$4,8/3/2020,United States,San Carlos,Other,"Blackrock, Kleiner Perkins Caulfield & Byers, Google Ventures"
192,206,Branch,$4,9/10/2018,United States,Redwood City,Mobile & telecommunications,"New Enterprise Associates, Pear, Cowboy Ventures"
193,207,Aurora Solar,$4,5/24/2021,United States,San Francisco,Internet software & services,"Fifth Wall Ventures, Energize Ventures, ICONIQ Capital"
194,208,Webflow,$4,1/13/2021,United States,San Francisco,Internet software & services,"Accel, Silversmith Capital Partners, capitalG"
195,209,Yuga Labs,$4,3/22/2022,United States,Miami,Fintech,"Andreessen Horowitz, Thrive Capital, Sound Ventures"
196,211,Abnormal Security,$4,5/10/2022,United States,San Francisco,Cybersecurity,"Greylock Partners, Insight Partners,Menlo Ventures"
197,212,Medlinker,$3.92,7/31/2018,China,Chengdu,Health,"China Health Industry Investment Fund, China Renaissance, and Sequoia Capital China"
198,213,Intarcia Therapeutics,$3.8,4/1/2014,United States,Boston,Health,"New Enterprise Associates, New Leaf Venture Partners, Charter Venture Capital"
199,214,StockX,$3.8,6/26/2019,United States,Detroit,E-commerce & direct-to-consumer,"Google Ventures, Battery Ventures, DST Global"
200,215,MessageBird,$3.8,10/8/2020,Netherlands,Amsterdam,Mobile & telecommunications,"Y Combinator, Atomico, Accel"
201,216,Convoy,$3.8,9/21/2018,United States,Seattle,"Supply chain, logistics, & delivery","Greylock Partners, capitalG, Y Combinator"
202,217,Articulate,$3.75,7/1/2021,United States,New York,Edtech,"Blackstone, ICONIQ Growth, General Atlantic"
203,218,FalconX,$3.75,8/10/2021,United States,San Mateo,Fintech,"Tiger Global Management, American Express Ventures, B Capital Group"
204,219,Dutchie,$3.75,3/16/2021,United States,Bend,E-commerce & direct-to-consumer,"Casa Verde Capital, Gron Ventures, Thrity Five Ventures"
205,220,Cohesity,$3.7,6/11/2018,United States,San Jose,Data management & analytics,"SoftBank Group, Sequoia Capital, Wing Venture Capital"
206,221,VAST Data,$3.7,4/16/2020,United States,New York,Data management & analytics,"Norwest Venture Partners, Goldman Sachs, Dell Technologies Capital"
